{"data":[{"byannouncementtype":[{"type":{"id":2,"issystem":true,"cancreate":true,"name":"HW","description":"Homework"},"announcements":[{"created":"5/9/2012 03:22:23 PM","announcementtypename":"HW","announcementtypeid":2,"expiresdate":"2012-05-10","isowner":true,"gradable":true,"starred":false,"id":56242,"order":1,"state":0,"statetyped":0,"qnacount":0,"attachmentscount":0,"ownerattachmentscount":0,"title":"All","recipientid":null,"content":null,"shortcontent":null,"subject":null,"schoolpersonref":1291988,"schoolpersonname":null,"schoolpersongender":null,"announcementtyperef":2,"systemtype":2,"grade":null,"studentannouncementid":null,"dropped":false,"studentscount":0,"studentscountwithattachments":0,"studentscountwithoutattachments":0,"gradingstudentscount":0,"nongradingstudentscount":0,"comment":null,"class":null,"gradesummary":null,"attachmentsummary":null,"avg":77,"avgnumeric":77,"gradingstyle":0,"applicationscount":0,"applicationname":null,"wasannouncementtypegraded":null,"showgradingicon":false},{"created":"10/4/2012 04:00:00 PM","announcementtypename":"HW","announcementtypeid":2,"expiresdate":"2012-10-05","isowner":true,"gradable":true,"starred":false,"id":56243,"order":2,"state":0,"statetyped":0,"qnacount":0,"attachmentscount":0,"ownerattachmentscount":0,"title":"All","recipientid":null,"content":null,"shortcontent":null,"subject":null,"schoolpersonref":1291988,"schoolpersonname":null,"schoolpersongender":null,"announcementtyperef":2,"systemtype":2,"grade":null,"studentannouncementid":null,"dropped":true,"studentscount":0,"studentscountwithattachments":0,"studentscountwithoutattachments":0,"gradingstudentscount":0,"nongradingstudentscount":0,"comment":null,"class":null,"gradesummary":null,"attachmentsummary":null,"avg":87,"avgnumeric":87,"gradingstyle":0,"applicationscount":0,"applicationname":null,"wasannouncementtypegraded":null,"showgradingicon":false},{"created":"10/9/2012 08:00:47 PM","announcementtypename":"HW","announcementtypeid":2,"expiresdate":"2012-10-10","isowner":true,"gradable":true,"starred":false,"id":56245,"order":3,"state":0,"statetyped":0,"qnacount":0,"attachmentscount":0,"ownerattachmentscount":0,"title":"All","recipientid":null,"content":null,"shortcontent":null,"subject":null,"schoolpersonref":1291988,"schoolpersonname":null,"schoolpersongender":null,"announcementtyperef":2,"systemtype":2,"grade":null,"studentannouncementid":null,"dropped":false,"studentscount":0,"studentscountwithattachments":0,"studentscountwithoutattachments":0,"gradingstudentscount":0,"nongradingstudentscount":0,"comment":null,"class":null,"gradesummary":null,"attachmentsummary":null,"avg":95,"avgnumeric":95,"gradingstyle":0,"applicationscount":0,"applicationname":null,"wasannouncementtypegraded":null,"showgradingicon":false},{"created":"11/28/2012 03:17:55 PM","announcementtypename":"HW","announcementtypeid":2,"expiresdate":"2012-11-29","isowner":true,"gradable":true,"starred":false,"id":56247,"order":4,"state":0,"statetyped":0,"qnacount":0,"attachmentscount":0,"ownerattachmentscount":0,"title":"All","recipientid":null,"content":null,"shortcontent":null,"subject":null,"schoolpersonref":1291988,"schoolpersonname":null,"schoolpersongender":null,"announcementtyperef":2,"systemtype":2,"grade":null,"studentannouncementid":null,"dropped":true,"studentscount":0,"studentscountwithattachments":0,"studentscountwithoutattachments":0,"gradingstudentscount":0,"nongradingstudentscount":0,"comment":null,"class":null,"gradesummary":null,"attachmentsummary":null,"avg":53,"avgnumeric":53,"gradingstyle":0,"applicationscount":0,"applicationname":null,"wasannouncementtypegraded":null,"showgradingicon":false},{"created":"12/3/2012 06:15:34 PM","announcementtypename":"HW","announcementtypeid":2,"expiresdate":"2012-11-29","isowner":true,"gradable":true,"starred":false,"id":56249,"order":5,"state":0,"statetyped":0,"qnacount":0,"attachmentscount":0,"ownerattachmentscount":0,"title":"All","recipientid":null,"content":null,"shortcontent":null,"subject":null,"schoolpersonref":1291988,"schoolpersonname":null,"schoolpersongender":null,"announcementtyperef":2,"systemtype":2,"grade":null,"studentannouncementid":null,"dropped":false,"studentscount":0,"studentscountwithattachments":0,"studentscountwithoutattachments":0,"gradingstudentscount":0,"nongradingstudentscount":0,"comment":null,"class":null,"gradesummary":null,"attachmentsummary":null,"avg":null,"avgnumeric":null,"gradingstyle":0,"applicationscount":0,"applicationname":null,"wasannouncementtypegraded":null,"showgradingicon":false},{"created":"1/9/2013 05:16:51 PM","announcementtypename":"HW","announcementtypeid":2,"expiresdate":"2013-01-10","isowner":true,"gradable":true,"starred":false,"id":58670,"order":6,"state":0,"statetyped":0,"qnacount":0,"attachmentscount":0,"ownerattachmentscount":0,"title":"All","recipientid":null,"content":null,"shortcontent":null,"subject":null,"schoolpersonref":1291988,"schoolpersonname":null,"schoolpersongender":null,"announcementtyperef":2,"systemtype":2,"grade":null,"studentannouncementid":null,"dropped":false,"studentscount":0,"studentscountwithattachments":0,"studentscountwithoutattachments":0,"gradingstudentscount":0,"nongradingstudentscount":0,"comment":null,"class":null,"gradesummary":null,"attachmentsummary":null,"avg":95,"avgnumeric":95,"gradingstyle":0,"applicationscount":0,"applicationname":null,"wasannouncementtypegraded":null,"showgradingicon":false},{"created":"1/15/2013 05:09:39 PM","announcementtypename":"HW","announcementtypeid":2,"expiresdate":"2013-01-17","isowner":true,"gradable":true,"starred":false,"id":60649,"order":7,"state":0,"statetyped":0,"qnacount":0,"attachmentscount":0,"ownerattachmentscount":0,"title":"All","recipientid":null,"content":null,"shortcontent":null,"subject":null,"schoolpersonref":1291988,"schoolpersonname":null,"schoolpersongender":null,"announcementtyperef":2,"systemtype":2,"grade":null,"studentannouncementid":null,"dropped":false,"studentscount":0,"studentscountwithattachments":0,"studentscountwithoutattachments":0,"gradingstudentscount":0,"nongradingstudentscount":0,"comment":null,"class":null,"gradesummary":null,"attachmentsummary":null,"avg":86,"avgnumeric":86,"gradingstyle":0,"applicationscount":0,"applicationname":null,"wasannouncementtypegraded":null,"showgradingicon":false},{"created":"1/18/2013 04:12:43 PM","announcementtypename":"HW","announcementtypeid":2,"expiresdate":"2013-01-21","isowner":true,"gradable":true,"starred":false,"id":62094,"order":8,"state":0,"statetyped":0,"qnacount":0,"attachmentscount":0,"ownerattachmentscount":0,"title":"All","recipientid":null,"content":null,"shortcontent":null,"subject":null,"schoolpersonref":1291988,"schoolpersonname":null,"schoolpersongender":null,"announcementtyperef":2,"systemtype":2,"grade":null,"studentannouncementid":null,"dropped":false,"studentscount":0,"studentscountwithattachments":0,"studentscountwithoutattachments":0,"gradingstudentscount":0,"nongradingstudentscount":0,"comment":null,"class":null,"gradesummary":null,"attachmentsummary":null,"avg":95,"avgnumeric":95,"gradingstyle":0,"applicationscount":0,"applicationname":null,"wasannouncementtypegraded":null,"showgradingicon":false},{"created":"1/20/2013 10:12:47 PM","announcementtypename":"HW","announcementtypeid":2,"expiresdate":"2013-01-22","isowner":true,"gradable":true,"starred":false,"id":62678,"order":9,"state":0,"statetyped":0,"qnacount":0,"attachmentscount":0,"ownerattachmentscount":0,"title":"All","recipientid":null,"content":null,"shortcontent":null,"subject":null,"schoolpersonref":1291988,"schoolpersonname":null,"schoolpersongender":null,"announcementtyperef":2,"systemtype":2,"grade":null,"studentannouncementid":null,"dropped":false,"studentscount":0,"studentscountwithattachments":0,"studentscountwithoutattachments":0,"gradingstudentscount":0,"nongradingstudentscount":0,"comment":null,"class":null,"gradesummary":null,"attachmentsummary":null,"avg":65,"avgnumeric":65,"gradingstyle":0,"applicationscount":0,"applicationname":null,"wasannouncementtypegraded":null,"showgradingicon":false},{"created":"1/25/2013 04:24:34 AM","announcementtypename":"HW","announcementtypeid":2,"expiresdate":"2013-01-24","isowner":true,"gradable":true,"starred":false,"id":63889,"order":10,"state":0,"statetyped":0,"qnacount":0,"attachmentscount":0,"ownerattachmentscount":0,"title":"All","recipientid":null,"content":null,"shortcontent":null,"subject":null,"schoolpersonref":1291988,"schoolpersonname":null,"schoolpersongender":null,"announcementtyperef":2,"systemtype":2,"grade":null,"studentannouncementid":null,"dropped":false,"studentscount":0,"studentscountwithattachments":0,"studentscountwithoutattachments":0,"gradingstudentscount":0,"nongradingstudentscount":0,"comment":null,"class":null,"gradesummary":null,"attachmentsummary":null,"avg":null,"avgnumeric":null,"gradingstyle":0,"applicationscount":0,"applicationname":null,"wasannouncementtypegraded":null,"showgradingicon":false},{"created":"1/25/2013 02:27:17 AM","announcementtypename":"HW","announcementtypeid":2,"expiresdate":"2013-01-28","isowner":true,"gradable":true,"starred":false,"id":63860,"order":11,"state":0,"statetyped":0,"qnacount":0,"attachmentscount":0,"ownerattachmentscount":0,"title":"All","recipientid":null,"content":null,"shortcontent":null,"subject":null,"schoolpersonref":1291988,"schoolpersonname":null,"schoolpersongender":null,"announcementtyperef":2,"systemtype":2,"grade":null,"studentannouncementid":null,"dropped":false,"studentscount":0,"studentscountwithattachments":0,"studentscountwithoutattachments":0,"gradingstudentscount":0,"nongradingstudentscount":0,"comment":null,"class":null,"gradesummary":null,"attachmentsummary":null,"avg":null,"avgnumeric":null,"gradingstyle":0,"applicationscount":0,"applicationname":null,"wasannouncementtypegraded":null,"showgradingicon":false},{"created":"1/25/2013 07:41:53 PM","announcementtypename":"HW","announcementtypeid":2,"expiresdate":"2013-01-28","isowner":true,"gradable":true,"starred":false,"id":64087,"order":12,"state":0,"statetyped":0,"qnacount":0,"attachmentscount":0,"ownerattachmentscount":0,"title":"All","recipientid":null,"content":null,"shortcontent":null,"subject":null,"schoolpersonref":1291988,"schoolpersonname":null,"schoolpersongender":null,"announcementtyperef":2,"systemtype":2,"grade":null,"studentannouncementid":null,"dropped":false,"studentscount":0,"studentscountwithattachments":0,"studentscountwithoutattachments":0,"gradingstudentscount":0,"nongradingstudentscount":0,"comment":null,"class":null,"gradesummary":null,"attachmentsummary":null,"avg":null,"avgnumeric":null,"gradingstyle":0,"applicationscount":0,"applicationname":null,"wasannouncementtypegraded":null,"showgradingicon":false},{"created":"1/25/2013 02:29:03 AM","announcementtypename":"HW","announcementtypeid":2,"expiresdate":"2013-01-29","isowner":true,"gradable":true,"starred":false,"id":63861,"order":13,"state":0,"statetyped":0,"qnacount":0,"attachmentscount":0,"ownerattachmentscount":0,"title":"All","recipientid":null,"content":null,"shortcontent":null,"subject":null,"schoolpersonref":1291988,"schoolpersonname":null,"schoolpersongender":null,"announcementtyperef":2,"systemtype":2,"grade":null,"studentannouncementid":null,"dropped":false,"studentscount":0,"studentscountwithattachments":0,"studentscountwithoutattachments":0,"gradingstudentscount":0,"nongradingstudentscount":0,"comment":null,"class":null,"gradesummary":null,"attachmentsummary":null,"avg":null,"avgnumeric":null,"gradingstyle":0,"applicationscount":0,"applicationname":null,"wasannouncementtypegraded":null,"showgradingicon":false},{"created":"1/25/2013 05:30:59 AM","announcementtypename":"HW","announcementtypeid":2,"expiresdate":"2013-01-29","isowner":true,"gradable":true,"starred":false,"id":63930,"order":14,"state":0,"statetyped":0,"qnacount":0,"attachmentscount":0,"ownerattachmentscount":0,"title":"All","recipientid":null,"content":null,"shortcontent":null,"subject":null,"schoolpersonref":1291988,"schoolpersonname":null,"schoolpersongender":null,"announcementtyperef":2,"systemtype":2,"grade":null,"studentannouncementid":null,"dropped":false,"studentscount":0,"studentscountwithattachments":0,"studentscountwithoutattachments":0,"gradingstudentscount":0,"nongradingstudentscount":0,"comment":null,"class":null,"gradesummary":null,"attachmentsummary":null,"avg":89,"avgnumeric":89,"gradingstyle":0,"applicationscount":0,"applicationname":null,"wasannouncementtypegraded":null,"showgradingicon":false},{"created":"2/3/2013 09:32:37 PM","announcementtypename":"HW","announcementtypeid":2,"expiresdate":"2013-02-04","isowner":true,"gradable":true,"starred":false,"id":68663,"order":15,"state":0,"statetyped":0,"qnacount":0,"attachmentscount":0,"ownerattachmentscount":0,"title":"All","recipientid":null,"content":null,"shortcontent":null,"subject":null,"schoolpersonref":1291988,"schoolpersonname":null,"schoolpersongender":null,"announcementtyperef":2,"systemtype":2,"grade":null,"studentannouncementid":null,"dropped":false,"studentscount":0,"studentscountwithattachments":0,"studentscountwithoutattachments":0,"gradingstudentscount":0,"nongradingstudentscount":0,"comment":null,"class":null,"gradesummary":null,"attachmentsummary":null,"avg":null,"avgnumeric":null,"gradingstyle":0,"applicationscount":0,"applicationname":null,"wasannouncementtypegraded":null,"showgradingicon":false},{"created":"2/3/2013 10:02:46 PM","announcementtypename":"HW","announcementtypeid":2,"expiresdate":"2013-02-05","isowner":true,"gradable":true,"starred":false,"id":68664,"order":16,"state":0,"statetyped":0,"qnacount":0,"attachmentscount":0,"ownerattachmentscount":0,"title":"All","recipientid":null,"content":null,"shortcontent":null,"subject":null,"schoolpersonref":1291988,"schoolpersonname":null,"schoolpersongender":null,"announcementtyperef":2,"systemtype":2,"grade":null,"studentannouncementid":null,"dropped":false,"studentscount":0,"studentscountwithattachments":0,"studentscountwithoutattachments":0,"gradingstudentscount":0,"nongradingstudentscount":0,"comment":null,"class":null,"gradesummary":null,"attachmentsummary":null,"avg":90,"avgnumeric":90,"gradingstyle":0,"applicationscount":0,"applicationname":null,"wasannouncementtypegraded":null,"showgradingicon":false},{"created":"3/19/2013 04:52:20 PM","announcementtypename":"HW","announcementtypeid":2,"expiresdate":"2013-03-20","isowner":true,"gradable":true,"starred":false,"id":92014,"order":17,"state":0,"statetyped":0,"qnacount":0,"attachmentscount":0,"ownerattachmentscount":0,"title":"All","recipientid":null,"content":null,"shortcontent":null,"subject":null,"schoolpersonref":1291988,"schoolpersonname":null,"schoolpersongender":null,"announcementtyperef":2,"systemtype":2,"grade":null,"studentannouncementid":null,"dropped":false,"studentscount":0,"studentscountwithattachments":0,"studentscountwithoutattachments":0,"gradingstudentscount":0,"nongradingstudentscount":0,"comment":null,"class":null,"gradesummary":null,"attachmentsummary":null,"avg":null,"avgnumeric":null,"gradingstyle":0,"applicationscount":0,"applicationname":null,"wasannouncementtypegraded":null,"showgradingicon":false},{"created":"3/22/2013 05:11:50 PM","announcementtypename":"HW","announcementtypeid":2,"expiresdate":"2013-03-23","isowner":true,"gradable":true,"starred":false,"id":93592,"order":18,"state":0,"statetyped":0,"qnacount":0,"attachmentscount":0,"ownerattachmentscount":0,"title":"All","recipientid":null,"content":null,"shortcontent":null,"subject":null,"schoolpersonref":1291988,"schoolpersonname":null,"schoolpersongender":null,"announcementtyperef":2,"systemtype":2,"grade":null,"studentannouncementid":null,"dropped":false,"studentscount":0,"studentscountwithattachments":0,"studentscountwithoutattachments":0,"gradingstudentscount":0,"nongradingstudentscount":0,"comment":null,"class":null,"gradesummary":null,"attachmentsummary":null,"avg":null,"avgnumeric":null,"gradingstyle":0,"applicationscount":0,"applicationname":null,"wasannouncementtypegraded":null,"showgradingicon":false},{"created":"3/25/2013 03:11:31 PM","announcementtypename":"HW","announcementtypeid":2,"expiresdate":"2013-03-26","isowner":true,"gradable":true,"starred":false,"id":94395,"order":19,"state":0,"statetyped":0,"qnacount":0,"attachmentscount":0,"ownerattachmentscount":0,"title":"All","recipientid":null,"content":null,"shortcontent":null,"subject":null,"schoolpersonref":1291988,"schoolpersonname":null,"schoolpersongender":null,"announcementtyperef":2,"systemtype":2,"grade":null,"studentannouncementid":null,"dropped":false,"studentscount":0,"studentscountwithattachments":0,"studentscountwithoutattachments":0,"gradingstudentscount":0,"nongradingstudentscount":0,"comment":null,"class":null,"gradesummary":null,"attachmentsummary":null,"avg":null,"avgnumeric":null,"gradingstyle":0,"applicationscount":0,"applicationname":null,"wasannouncementtypegraded":null,"showgradingicon":false},{"created":"3/28/2013 03:06:32 PM","announcementtypename":"HW","announcementtypeid":2,"expiresdate":"2013-03-29","isowner":true,"gradable":true,"starred":false,"id":99715,"order":20,"state":0,"statetyped":0,"qnacount":0,"attachmentscount":0,"ownerattachmentscount":0,"title":"All","recipientid":null,"content":null,"shortcontent":null,"subject":null,"schoolpersonref":1291988,"schoolpersonname":null,"schoolpersongender":null,"announcementtyperef":2,"systemtype":2,"grade":null,"studentannouncementid":null,"dropped":false,"studentscount":0,"studentscountwithattachments":0,"studentscountwithoutattachments":0,"gradingstudentscount":0,"nongradingstudentscount":0,"comment":null,"class":null,"gradesummary":null,"attachmentsummary":null,"avg":null,"avgnumeric":null,"gradingstyle":0,"applicationscount":0,"applicationname":null,"wasannouncementtypegraded":null,"showgradingicon":false},{"created":"4/23/2013 07:31:01 PM","announcementtypename":"HW","announcementtypeid":2,"expiresdate":"2013-04-24","isowner":true,"gradable":true,"starred":false,"id":116332,"order":21,"state":0,"statetyped":0,"qnacount":0,"attachmentscount":0,"ownerattachmentscount":0,"title":"All","recipientid":null,"content":null,"shortcontent":null,"subject":null,"schoolpersonref":1291988,"schoolpersonname":null,"schoolpersongender":null,"announcementtyperef":2,"systemtype":2,"grade":null,"studentannouncementid":null,"dropped":false,"studentscount":0,"studentscountwithattachments":0,"studentscountwithoutattachments":0,"gradingstudentscount":0,"nongradingstudentscount":0,"comment":null,"class":null,"gradesummary":null,"attachmentsummary":null,"avg":86,"avgnumeric":86,"gradingstyle":0,"applicationscount":0,"applicationname":null,"wasannouncementtypegraded":null,"showgradingicon":false},{"created":"4/25/2013 06:24:47 PM","announcementtypename":"HW","announcementtypeid":2,"expiresdate":"2013-04-25","isowner":true,"gradable":true,"starred":false,"id":117112,"order":22,"state":0,"statetyped":0,"qnacount":0,"attachmentscount":0,"ownerattachmentscount":0,"title":"All","recipientid":null,"content":null,"shortcontent":null,"subject":null,"schoolpersonref":1291988,"schoolpersonname":null,"schoolpersongender":null,"announcementtyperef":2,"systemtype":2,"grade":null,"studentannouncementid":null,"dropped":false,"studentscount":0,"studentscountwithattachments":0,"studentscountwithoutattachments":0,"gradingstudentscount":0,"nongradingstudentscount":0,"comment":null,"class":null,"gradesummary":null,"attachmentsummary":null,"avg":null,"avgnumeric":null,"gradingstyle":0,"applicationscount":0,"applicationname":null,"wasannouncementtypegraded":null,"showgradingicon":false},{"created":"4/25/2013 06:26:03 PM","announcementtypename":"HW","announcementtypeid":2,"expiresdate":"2013-04-26","isowner":true,"gradable":true,"starred":false,"id":117113,"order":23,"state":0,"statetyped":0,"qnacount":0,"attachmentscount":0,"ownerattachmentscount":0,"title":"All","recipientid":null,"content":null,"shortcontent":null,"subject":null,"schoolpersonref":1291988,"schoolpersonname":null,"schoolpersongender":null,"announcementtyperef":2,"systemtype":2,"grade":null,"studentannouncementid":null,"dropped":false,"studentscount":0,"studentscountwithattachments":0,"studentscountwithoutattachments":0,"gradingstudentscount":0,"nongradingstudentscount":0,"comment":null,"class":null,"gradesummary":null,"attachmentsummary":null,"avg":null,"avgnumeric":null,"gradingstyle":0,"applicationscount":0,"applicationname":null,"wasannouncementtypegraded":null,"showgradingicon":false},{"created":"4/30/2013 01:11:55 AM","announcementtypename":"HW","announcementtypeid":2,"expiresdate":"2013-04-29","isowner":true,"gradable":true,"starred":false,"id":119201,"order":24,"state":0,"statetyped":0,"qnacount":0,"attachmentscount":0,"ownerattachmentscount":0,"title":"All","recipientid":null,"content":null,"shortcontent":null,"subject":null,"schoolpersonref":1291988,"schoolpersonname":null,"schoolpersongender":null,"announcementtyperef":2,"systemtype":2,"grade":null,"studentannouncementid":null,"dropped":false,"studentscount":0,"studentscountwithattachments":0,"studentscountwithoutattachments":0,"gradingstudentscount":0,"nongradingstudentscount":0,"comment":null,"class":null,"gradesummary":null,"attachmentsummary":null,"avg":null,"avgnumeric":null,"gradingstyle":0,"applicationscount":0,"applicationname":null,"wasannouncementtypegraded":null,"showgradingicon":false},{"created":"4/29/2013 08:29:18 PM","announcementtypename":"HW","announcementtypeid":2,"expiresdate":"2013-04-30","isowner":true,"gradable":true,"starred":false,"id":118950,"order":25,"state":0,"statetyped":0,"qnacount":0,"attachmentscount":0,"ownerattachmentscount":0,"title":"All","recipientid":null,"content":null,"shortcontent":null,"subject":null,"schoolpersonref":1291988,"schoolpersonname":null,"schoolpersongender":null,"announcementtyperef":2,"systemtype":2,"grade":null,"studentannouncementid":null,"dropped":false,"studentscount":0,"studentscountwithattachments":0,"studentscountwithoutattachments":0,"gradingstudentscount":0,"nongradingstudentscount":0,"comment":null,"class":null,"gradesummary":null,"attachmentsummary":null,"avg":null,"avgnumeric":null,"gradingstyle":0,"applicationscount":0,"applicationname":null,"wasannouncementtypegraded":null,"showgradingicon":false},{"created":"5/2/2013 02:46:24 PM","announcementtypename":"HW","announcementtypeid":2,"expiresdate":"2013-05-03","isowner":true,"gradable":true,"starred":false,"id":120953,"order":26,"state":0,"statetyped":0,"qnacount":0,"attachmentscount":0,"ownerattachmentscount":0,"title":"All","recipientid":null,"content":null,"shortcontent":null,"subject":null,"schoolpersonref":1291988,"schoolpersonname":null,"schoolpersongender":null,"announcementtyperef":2,"systemtype":2,"grade":null,"studentannouncementid":null,"dropped":false,"studentscount":0,"studentscountwithattachments":0,"studentscountwithoutattachments":0,"gradingstudentscount":0,"nongradingstudentscount":0,"comment":null,"class":null,"gradesummary":null,"attachmentsummary":null,"avg":96,"avgnumeric":96,"gradingstyle":0,"applicationscount":0,"applicationname":null,"wasannouncementtypegraded":null,"showgradingicon":false},{"created":"5/7/2013 03:53:32 PM","announcementtypename":"HW","announcementtypeid":2,"expiresdate":"2013-05-08","isowner":true,"gradable":true,"starred":false,"id":123000,"order":27,"state":0,"statetyped":0,"qnacount":0,"attachmentscount":0,"ownerattachmentscount":0,"title":"All","recipientid":null,"content":null,"shortcontent":null,"subject":null,"schoolpersonref":1291988,"schoolpersonname":null,"schoolpersongender":null,"announcementtyperef":2,"systemtype":2,"grade":null,"studentannouncementid":null,"dropped":false,"studentscount":0,"studentscountwithattachments":0,"studentscountwithoutattachments":0,"gradingstudentscount":0,"nongradingstudentscount":0,"comment":null,"class":null,"gradesummary":null,"attachmentsummary":null,"avg":97,"avgnumeric":97,"gradingstyle":0,"applicationscount":0,"applicationname":null,"wasannouncementtypegraded":null,"showgradingicon":false},{"created":"5/7/2013 05:43:59 PM","announcementtypename":"HW","announcementtypeid":2,"expiresdate":"2013-05-08","isowner":true,"gradable":true,"starred":false,"id":123025,"order":28,"state":0,"statetyped":0,"qnacount":0,"attachmentscount":0,"ownerattachmentscount":0,"title":"All","recipientid":null,"content":null,"shortcontent":null,"subject":null,"schoolpersonref":1291988,"schoolpersonname":null,"schoolpersongender":null,"announcementtyperef":2,"systemtype":2,"grade":null,"studentannouncementid":null,"dropped":false,"studentscount":0,"studentscountwithattachments":0,"studentscountwithoutattachments":0,"gradingstudentscount":0,"nongradingstudentscount":0,"comment":null,"class":null,"gradesummary":null,"attachmentsummary":null,"avg":97,"avgnumeric":97,"gradingstyle":0,"applicationscount":0,"applicationname":null,"wasannouncementtypegraded":null,"showgradingicon":false},{"created":"5/9/2013 09:14:18 PM","announcementtypename":"HW","announcementtypeid":2,"expiresdate":"2013-05-10","isowner":true,"gradable":true,"starred":false,"id":124148,"order":29,"state":0,"statetyped":0,"qnacount":0,"attachmentscount":0,"ownerattachmentscount":0,"title":"All","recipientid":null,"content":null,"shortcontent":null,"subject":null,"schoolpersonref":1291988,"schoolpersonname":null,"schoolpersongender":null,"announcementtyperef":2,"systemtype":2,"grade":null,"studentannouncementid":null,"dropped":false,"studentscount":0,"studentscountwithattachments":0,"studentscountwithoutattachments":0,"gradingstudentscount":0,"nongradingstudentscount":0,"comment":null,"class":null,"gradesummary":null,"attachmentsummary":null,"avg":97,"avgnumeric":97,"gradingstyle":0,"applicationscount":0,"applicationname":null,"wasannouncementtypegraded":null,"showgradingicon":false},{"created":"5/28/2013 03:13:35 PM","announcementtypename":"HW","announcementtypeid":2,"expiresdate":"2013-05-29","isowner":true,"gradable":true,"starred":false,"id":134324,"order":30,"state":0,"statetyped":0,"qnacount":0,"attachmentscount":0,"ownerattachmentscount":0,"title":"All","recipientid":null,"content":null,"shortcontent":null,"subject":null,"schoolpersonref":1291988,"schoolpersonname":null,"schoolpersongender":null,"announcementtyperef":2,"systemtype":2,"grade":null,"studentannouncementid":null,"dropped":false,"studentscount":0,"studentscountwithattachments":0,"studentscountwithoutattachments":0,"gradingstudentscount":0,"nongradingstudentscount":0,"comment":null,"class":null,"gradesummary":null,"attachmentsummary":null,"avg":null,"avgnumeric":null,"gradingstyle":0,"applicationscount":0,"applicationname":null,"wasannouncementtypegraded":null,"showgradingicon":false},{"created":"5/30/2013 10:28:39 AM","announcementtypename":"HW","announcementtypeid":2,"expiresdate":"2013-05-31","isowner":true,"gradable":true,"starred":false,"id":135569,"order":31,"state":0,"statetyped":0,"qnacount":0,"attachmentscount":0,"ownerattachmentscount":0,"title":"All","recipientid":null,"content":null,"shortcontent":null,"subject":null,"schoolpersonref":1291988,"schoolpersonname":null,"schoolpersongender":null,"announcementtyperef":2,"systemtype":2,"grade":null,"studentannouncementid":null,"dropped":false,"studentscount":0,"studentscountwithattachments":0,"studentscountwithoutattachments":0,"gradingstudentscount":0,"nongradingstudentscount":0,"comment":null,"class":null,"gradesummary":null,"attachmentsummary":null,"avg":100,"avgnumeric":100,"gradingstyle":0,"applicationscount":0,"applicationname":null,"wasannouncementtypegraded":null,"showgradingicon":false},{"created":"5/30/2013 10:51:29 AM","announcementtypename":"HW","announcementtypeid":2,"expiresdate":"2013-05-31","isowner":true,"gradable":true,"starred":false,"id":136075,"order":32,"state":0,"statetyped":0,"qnacount":0,"attachmentscount":0,"ownerattachmentscount":0,"title":"All","recipientid":null,"content":null,"shortcontent":null,"subject":null,"schoolpersonref":1291988,"schoolpersonname":null,"schoolpersongender":null,"announcementtyperef":2,"systemtype":2,"grade":null,"studentannouncementid":null,"dropped":false,"studentscount":0,"studentscountwithattachments":0,"studentscountwithoutattachments":0,"gradingstudentscount":0,"nongradingstudentscount":0,"comment":null,"class":null,"gradesummary":null,"attachmentsummary":null,"avg":null,"avgnumeric":null,"gradingstyle":0,"applicationscount":0,"applicationname":null,"wasannouncementtypegraded":null,"showgradingicon":false},{"created":"6/7/2013 10:52:52 AM","announcementtypename":"HW","announcementtypeid":2,"expiresdate":"2013-06-10","isowner":true,"gradable":true,"starred":false,"id":142639,"order":33,"state":0,"statetyped":0,"qnacount":0,"attachmentscount":0,"ownerattachmentscount":0,"title":"All","recipientid":null,"content":null,"shortcontent":null,"subject":null,"schoolpersonref":1291988,"schoolpersonname":null,"schoolpersongender":null,"announcementtyperef":2,"systemtype":2,"grade":null,"studentannouncementid":null,"dropped":false,"studentscount":0,"studentscountwithattachments":0,"studentscountwithoutattachments":0,"gradingstudentscount":0,"nongradingstudentscount":0,"comment":null,"class":null,"gradesummary":null,"attachmentsummary":null,"avg":null,"avgnumeric":null,"gradingstyle":0,"applicationscount":0,"applicationname":null,"wasannouncementtypegraded":null,"showgradingicon":false},{"created":"6/7/2013 12:31:15 PM","announcementtypename":"HW","announcementtypeid":2,"expiresdate":"2013-06-10","isowner":true,"gradable":true,"starred":false,"id":143167,"order":34,"state":0,"statetyped":0,"qnacount":0,"attachmentscount":0,"ownerattachmentscount":0,"title":"All","recipientid":null,"content":null,"shortcontent":null,"subject":null,"schoolpersonref":1291988,"schoolpersonname":null,"schoolpersongender":null,"announcementtyperef":2,"systemtype":2,"grade":null,"studentannouncementid":null,"dropped":false,"studentscount":0,"studentscountwithattachments":0,"studentscountwithoutattachments":0,"gradingstudentscount":0,"nongradingstudentscount":0,"comment":null,"class":null,"gradesummary":null,"attachmentsummary":null,"avg":null,"avgnumeric":null,"gradingstyle":0,"applicationscount":0,"applicationname":null,"wasannouncementtypegraded":null,"showgradingicon":false},{"created":"6/17/2013 05:11:00 PM","announcementtypename":"HW","announcementtypeid":2,"expiresdate":"2013-06-17","isowner":true,"gradable":true,"starred":false,"id":146693,"order":35,"state":0,"statetyped":0,"qnacount":0,"attachmentscount":0,"ownerattachmentscount":0,"title":"All","recipientid":null,"content":null,"shortcontent":null,"subject":null,"schoolpersonref":1291988,"schoolpersonname":null,"schoolpersongender":null,"announcementtyperef":2,"systemtype":2,"grade":null,"studentannouncementid":null,"dropped":false,"studentscount":0,"studentscountwithattachments":0,"studentscountwithoutattachments":0,"gradingstudentscount":0,"nongradingstudentscount":0,"comment":null,"class":null,"gradesummary":null,"attachmentsummary":null,"avg":93,"avgnumeric":93,"gradingstyle":0,"applicationscount":0,"applicationname":null,"wasannouncementtypegraded":null,"showgradingicon":false},{"created":"6/17/2013 06:05:44 PM","announcementtypename":"HW","announcementtypeid":2,"expiresdate":"2013-06-18","isowner":true,"gradable":true,"starred":false,"id":150759,"order":36,"state":0,"statetyped":0,"qnacount":0,"attachmentscount":0,"ownerattachmentscount":0,"title":"All","recipientid":null,"content":null,"shortcontent":null,"subject":null,"schoolpersonref":1291988,"schoolpersonname":null,"schoolpersongender":null,"announcementtyperef":2,"systemtype":2,"grade":null,"studentannouncementid":null,"dropped":false,"studentscount":0,"studentscountwithattachments":0,"studentscountwithoutattachments":0,"gradingstudentscount":0,"nongradingstudentscount":0,"comment":null,"class":null,"gradesummary":null,"attachmentsummary":null,"avg":null,"avgnumeric":null,"gradingstyle":0,"applicationscount":0,"applicationname":null,"wasannouncementtypegraded":null,"showgradingicon":false},{"created":"6/21/2013 05:14:07 PM","announcementtypename":"HW","announcementtypeid":2,"expiresdate":"2013-06-19","isowner":true,"gradable":true,"starred":false,"id":152074,"order":37,"state":0,"statetyped":0,"qnacount":0,"attachmentscount":0,"ownerattachmentscount":0,"title":"All","recipientid":null,"content":null,"shortcontent":null,"subject":null,"schoolpersonref":1291988,"schoolpersonname":null,"schoolpersongender":null,"announcementtyperef":2,"systemtype":2,"grade":null,"studentannouncementid":null,"dropped":false,"studentscount":0,"studentscountwithattachments":0,"studentscountwithoutattachments":0,"gradingstudentscount":0,"nongradingstudentscount":0,"comment":null,"class":null,"gradesummary":null,"attachmentsummary":null,"avg":null,"avgnumeric":null,"gradingstyle":0,"applicationscount":0,"applicationname":null,"wasannouncementtypegraded":null,"showgradingicon":false},{"created":"6/21/2013 05:38:31 PM","announcementtypename":"HW","announcementtypeid":2,"expiresdate":"2013-06-24","isowner":true,"gradable":true,"starred":false,"id":153263,"order":38,"state":0,"statetyped":0,"qnacount":0,"attachmentscount":0,"ownerattachmentscount":0,"title":"All","recipientid":null,"content":null,"shortcontent":null,"subject":null,"schoolpersonref":1291988,"schoolpersonname":null,"schoolpersongender":null,"announcementtyperef":2,"systemtype":2,"grade":null,"studentannouncementid":null,"dropped":false,"studentscount":0,"studentscountwithattachments":0,"studentscountwithoutattachments":0,"gradingstudentscount":0,"nongradingstudentscount":0,"comment":null,"class":null,"gradesummary":null,"attachmentsummary":null,"avg":null,"avgnumeric":null,"gradingstyle":0,"applicationscount":0,"applicationname":null,"wasannouncementtypegraded":null,"showgradingicon":false},{"created":"6/24/2013 03:52:20 PM","announcementtypename":"HW","announcementtypeid":2,"expiresdate":"2013-06-24","isowner":true,"gradable":true,"starred":false,"id":155527,"order":39,"state":0,"statetyped":0,"qnacount":0,"attachmentscount":0,"ownerattachmentscount":0,"title":"All","recipientid":null,"content":null,"shortcontent":null,"subject":null,"schoolpersonref":1291988,"schoolpersonname":null,"schoolpersongender":null,"announcementtyperef":2,"systemtype":2,"grade":null,"studentannouncementid":null,"dropped":false,"studentscount":0,"studentscountwithattachments":0,"studentscountwithoutattachments":0,"gradingstudentscount":0,"nongradingstudentscount":0,"comment":null,"class":null,"gradesummary":null,"attachmentsummary":null,"avg":null,"avgnumeric":null,"gradingstyle":0,"applicationscount":0,"applicationname":null,"wasannouncementtypegraded":null,"showgradingicon":false},{"created":"6/24/2013 07:45:25 AM","announcementtypename":"HW","announcementtypeid":2,"expiresdate":"2013-06-25","isowner":true,"gradable":true,"starred":false,"id":154810,"order":40,"state":0,"statetyped":0,"qnacount":0,"attachmentscount":0,"ownerattachmentscount":0,"title":"All","recipientid":null,"content":null,"shortcontent":null,"subject":null,"schoolpersonref":1291988,"schoolpersonname":null,"schoolpersongender":null,"announcementtyperef":2,"systemtype":2,"grade":null,"studentannouncementid":null,"dropped":false,"studentscount":0,"studentscountwithattachments":0,"studentscountwithoutattachments":0,"gradingstudentscount":0,"nongradingstudentscount":0,"comment":null,"class":null,"gradesummary":null,"attachmentsummary":null,"avg":null,"avgnumeric":null,"gradingstyle":0,"applicationscount":0,"applicationname":null,"wasannouncementtypegraded":null,"showgradingicon":false},{"created":"6/24/2013 11:25:15 AM","announcementtypename":"HW","announcementtypeid":2,"expiresdate":"2013-06-25","isowner":true,"gradable":true,"starred":false,"id":154811,"order":41,"state":0,"statetyped":0,"qnacount":0,"attachmentscount":0,"ownerattachmentscount":0,"title":"All","recipientid":null,"content":null,"shortcontent":null,"subject":null,"schoolpersonref":1291988,"schoolpersonname":null,"schoolpersongender":null,"announcementtyperef":2,"systemtype":2,"grade":null,"studentannouncementid":null,"dropped":false,"studentscount":0,"studentscountwithattachments":0,"studentscountwithoutattachments":0,"gradingstudentscount":0,"nongradingstudentscount":0,"comment":null,"class":null,"gradesummary":null,"attachmentsummary":null,"avg":96,"avgnumeric":96,"gradingstyle":0,"applicationscount":0,"applicationname":null,"wasannouncementtypegraded":null,"showgradingicon":false},{"created":"6/24/2013 01:15:49 PM","announcementtypename":"HW","announcementtypeid":2,"expiresdate":"2013-06-25","isowner":true,"gradable":true,"starred":false,"id":155366,"order":42,"state":0,"statetyped":0,"qnacount":0,"attachmentscount":0,"ownerattachmentscount":0,"title":"All","recipientid":null,"content":null,"shortcontent":null,"subject":null,"schoolpersonref":1291988,"schoolpersonname":null,"schoolpersongender":null,"announcementtyperef":2,"systemtype":2,"grade":null,"studentannouncementid":null,"dropped":false,"studentscount":0,"studentscountwithattachments":0,"studentscountwithoutattachments":0,"gradingstudentscount":0,"nongradingstudentscount":0,"comment":null,"class":null,"gradesummary":null,"attachmentsummary":null,"avg":null,"avgnumeric":null,"gradingstyle":0,"applicationscount":0,"applicationname":null,"wasannouncementtypegraded":null,"showgradingicon":false},{"created":"6/24/2013 01:49:34 PM","announcementtypename":"HW","announcementtypeid":2,"expiresdate":"2013-06-25","isowner":true,"gradable":true,"starred":false,"id":155394,"order":43,"state":0,"statetyped":0,"qnacount":0,"attachmentscount":0,"ownerattachmentscount":0,"title":"All","recipientid":null,"content":null,"shortcontent":null,"subject":null,"schoolpersonref":1291988,"schoolpersonname":null,"schoolpersongender":null,"announcementtyperef":2,"systemtype":2,"grade":null,"studentannouncementid":null,"dropped":false,"studentscount":0,"studentscountwithattachments":0,"studentscountwithoutattachments":0,"gradingstudentscount":0,"nongradingstudentscount":0,"comment":null,"class":null,"gradesummary":null,"attachmentsummary":null,"avg":72,"avgnumeric":72,"gradingstyle":0,"applicationscount":0,"applicationname":null,"wasannouncementtypegraded":null,"showgradingicon":false},{"created":"6/24/2013 02:24:12 PM","announcementtypename":"HW","announcementtypeid":2,"expiresdate":"2013-06-25","isowner":true,"gradable":true,"starred":false,"id":155395,"order":44,"state":0,"statetyped":0,"qnacount":0,"attachmentscount":0,"ownerattachmentscount":0,"title":"All","recipientid":null,"content":null,"shortcontent":null,"subject":null,"schoolpersonref":1291988,"schoolpersonname":null,"schoolpersongender":null,"announcementtyperef":2,"systemtype":2,"grade":null,"studentannouncementid":null,"dropped":false,"studentscount":0,"studentscountwithattachments":0,"studentscountwithoutattachments":0,"gradingstudentscount":0,"nongradingstudentscount":0,"comment":null,"class":null,"gradesummary":null,"attachmentsummary":null,"avg":null,"avgnumeric":null,"gradingstyle":0,"applicationscount":0,"applicationname":null,"wasannouncementtypegraded":null,"showgradingicon":false},{"created":"6/24/2013 05:22:13 PM","announcementtypename":"HW","announcementtypeid":2,"expiresdate":"2013-06-25","isowner":true,"gradable":true,"starred":false,"id":155662,"order":45,"state":0,"statetyped":0,"qnacount":0,"attachmentscount":0,"ownerattachmentscount":0,"title":"All","recipientid":null,"content":null,"shortcontent":null,"subject":null,"schoolpersonref":1291988,"schoolpersonname":null,"schoolpersongender":null,"announcementtyperef":2,"systemtype":2,"grade":null,"studentannouncementid":null,"dropped":false,"studentscount":0,"studentscountwithattachments":0,"studentscountwithoutattachments":0,"gradingstudentscount":0,"nongradingstudentscount":0,"comment":null,"class":null,"gradesummary":null,"attachmentsummary":null,"avg":83,"avgnumeric":83,"gradingstyle":0,"applicationscount":0,"applicationname":null,"wasannouncementtypegraded":null,"showgradingicon":false},{"created":"6/25/2013 02:39:31 PM","announcementtypename":"HW","announcementtypeid":2,"expiresdate":"2013-06-25","isowner":true,"gradable":true,"starred":false,"id":156727,"order":46,"state":0,"statetyped":0,"qnacount":0,"attachmentscount":0,"ownerattachmentscount":0,"title":"All","recipientid":null,"content":null,"shortcontent":null,"subject":null,"schoolpersonref":1291988,"schoolpersonname":null,"schoolpersongender":null,"announcementtyperef":2,"systemtype":2,"grade":null,"studentannouncementid":null,"dropped":false,"studentscount":0,"studentscountwithattachments":0,"studentscountwithoutattachments":0,"gradingstudentscount":0,"nongradingstudentscount":0,"comment":null,"class":null,"gradesummary":null,"attachmentsummary":null,"avg":null,"avgnumeric":null,"gradingstyle":0,"applicationscount":0,"applicationname":null,"wasannouncementtypegraded":null,"showgradingicon":false},{"created":"6/25/2013 02:58:07 PM","announcementtypename":"HW","announcementtypeid":2,"expiresdate":"2013-06-25","isowner":true,"gradable":true,"starred":false,"id":156755,"order":47,"state":0,"statetyped":0,"qnacount":0,"attachmentscount":0,"ownerattachmentscount":0,"title":"All","recipientid":null,"content":null,"shortcontent":null,"subject":null,"schoolpersonref":1291988,"schoolpersonname":null,"schoolpersongender":null,"announcementtyperef":2,"systemtype":2,"grade":null,"studentannouncementid":null,"dropped":false,"studentscount":0,"studentscountwithattachments":0,"studentscountwithoutattachments":0,"gradingstudentscount":0,"nongradingstudentscount":0,"comment":null,"class":null,"gradesummary":null,"attachmentsummary":null,"avg":97,"avgnumeric":97,"gradingstyle":0,"applicationscount":0,"applicationname":null,"wasannouncementtypegraded":null,"showgradingicon":false},{"created":"6/25/2013 03:44:55 PM","announcementtypename":"HW","announcementtypeid":2,"expiresdate":"2013-06-25","isowner":true,"gradable":true,"starred":false,"id":156756,"order":48,"state":0,"statetyped":0,"qnacount":0,"attachmentscount":0,"ownerattachmentscount":0,"title":"All","recipientid":null,"content":null,"shortcontent":null,"subject":null,"schoolpersonref":1291988,"schoolpersonname":null,"schoolpersongender":null,"announcementtyperef":2,"systemtype":2,"grade":null,"studentannouncementid":null,"dropped":false,"studentscount":0,"studentscountwithattachments":0,"studentscountwithoutattachments":0,"gradingstudentscount":0,"nongradingstudentscount":0,"comment":null,"class":null,"gradesummary":null,"attachmentsummary":null,"avg":null,"avgnumeric":null,"gradingstyle":0,"applicationscount":0,"applicationname":null,"wasannouncementtypegraded":null,"showgradingicon":false},{"created":"6/25/2013 04:56:39 PM","announcementtypename":"HW","announcementtypeid":2,"expiresdate":"2013-06-25","isowner":true,"gradable":true,"starred":false,"id":156785,"order":49,"state":0,"statetyped":0,"qnacount":0,"attachmentscount":0,"ownerattachmentscount":0,"title":"All","recipientid":null,"content":null,"shortcontent":null,"subject":null,"schoolpersonref":1291988,"schoolpersonname":null,"schoolpersongender":null,"announcementtyperef":2,"systemtype":2,"grade":null,"studentannouncementid":null,"dropped":false,"studentscount":0,"studentscountwithattachments":0,"studentscountwithoutattachments":0,"gradingstudentscount":0,"nongradingstudentscount":0,"comment":null,"class":null,"gradesummary":null,"attachmentsummary":null,"avg":97,"avgnumeric":97,"gradingstyle":0,"applicationscount":0,"applicationname":null,"wasannouncementtypegraded":null,"showgradingicon":false},{"created":"6/25/2013 05:32:45 PM","announcementtypename":"HW","announcementtypeid":2,"expiresdate":"2013-06-25","isowner":true,"gradable":true,"starred":false,"id":156998,"order":50,"state":0,"statetyped":0,"qnacount":0,"attachmentscount":0,"ownerattachmentscount":0,"title":"All","recipientid":null,"content":null,"shortcontent":null,"subject":null,"schoolpersonref":1291988,"schoolpersonname":null,"schoolpersongender":null,"announcementtyperef":2,"systemtype":2,"grade":null,"studentannouncementid":null,"dropped":false,"studentscount":0,"studentscountwithattachments":0,"studentscountwithoutattachments":0,"gradingstudentscount":0,"nongradingstudentscount":0,"comment":null,"class":null,"gradesummary":null,"attachmentsummary":null,"avg":98,"avgnumeric":98,"gradingstyle":0,"applicationscount":0,"applicationname":null,"wasannouncementtypegraded":null,"showgradingicon":false},{"created":"6/25/2013 12:09:31 PM","announcementtypename":"HW","announcementtypeid":2,"expiresdate":"2013-06-26","isowner":true,"gradable":true,"starred":false,"id":156348,"order":51,"state":0,"statetyped":0,"qnacount":0,"attachmentscount":0,"ownerattachmentscount":0,"title":"All","recipientid":null,"content":null,"shortcontent":null,"subject":null,"schoolpersonref":1291988,"schoolpersonname":null,"schoolpersongender":null,"announcementtyperef":2,"systemtype":2,"grade":null,"studentannouncementid":null,"dropped":false,"studentscount":0,"studentscountwithattachments":0,"studentscountwithoutattachments":0,"gradingstudentscount":0,"nongradingstudentscount":0,"comment":null,"class":null,"gradesummary":null,"attachmentsummary":null,"avg":null,"avgnumeric":null,"gradingstyle":0,"applicationscount":0,"applicationname":null,"wasannouncementtypegraded":null,"showgradingicon":false},{"created":"6/25/2013 02:48:17 PM","announcementtypename":"HW","announcementtypeid":2,"expiresdate":"2013-06-26","isowner":true,"gradable":true,"starred":false,"id":156754,"order":52,"state":0,"statetyped":0,"qnacount":0,"attachmentscount":0,"ownerattachmentscount":0,"title":"All","recipientid":null,"content":null,"shortcontent":null,"subject":null,"schoolpersonref":1291988,"schoolpersonname":null,"schoolpersongender":null,"announcementtyperef":2,"systemtype":2,"grade":null,"studentannouncementid":null,"dropped":false,"studentscount":0,"studentscountwithattachments":0,"studentscountwithoutattachments":0,"gradingstudentscount":0,"nongradingstudentscount":0,"comment":null,"class":null,"gradesummary":null,"attachmentsummary":null,"avg":null,"avgnumeric":null,"gradingstyle":0,"applicationscount":0,"applicationname":null,"wasannouncementtypegraded":null,"showgradingicon":false},{"created":"6/25/2013 03:48:35 PM","announcementtypename":"HW","announcementtypeid":2,"expiresdate":"2013-06-26","isowner":true,"gradable":true,"starred":false,"id":156783,"order":53,"state":0,"statetyped":0,"qnacount":0,"attachmentscount":0,"ownerattachmentscount":0,"title":"All","recipientid":null,"content":null,"shortcontent":null,"subject":null,"schoolpersonref":1291988,"schoolpersonname":null,"schoolpersongender":null,"announcementtyperef":2,"systemtype":2,"grade":null,"studentannouncementid":null,"dropped":false,"studentscount":0,"studentscountwithattachments":0,"studentscountwithoutattachments":0,"gradingstudentscount":0,"nongradingstudentscount":0,"comment":null,"class":null,"gradesummary":null,"attachmentsummary":null,"avg":null,"avgnumeric":null,"gradingstyle":0,"applicationscount":0,"applicationname":null,"wasannouncementtypegraded":null,"showgradingicon":false},{"created":"6/25/2013 04:11:14 PM","announcementtypename":"HW","announcementtypeid":2,"expiresdate":"2013-06-26","isowner":true,"gradable":true,"starred":false,"id":156784,"order":54,"state":0,"statetyped":0,"qnacount":0,"attachmentscount":0,"ownerattachmentscount":0,"title":"All","recipientid":null,"content":null,"shortcontent":null,"subject":null,"schoolpersonref":1291988,"schoolpersonname":null,"schoolpersongender":null,"announcementtyperef":2,"systemtype":2,"grade":null,"studentannouncementid":null,"dropped":false,"studentscount":0,"studentscountwithattachments":0,"studentscountwithoutattachments":0,"gradingstudentscount":0,"nongradingstudentscount":0,"comment":null,"class":null,"gradesummary":null,"attachmentsummary":null,"avg":3,"avgnumeric":3,"gradingstyle":0,"applicationscount":0,"applicationname":null,"wasannouncementtypegraded":null,"showgradingicon":false},{"created":"6/25/2013 05:22:51 PM","announcementtypename":"HW","announcementtypeid":2,"expiresdate":"2013-06-26","isowner":true,"gradable":true,"starred":false,"id":156945,"order":55,"state":0,"statetyped":0,"qnacount":0,"attachmentscount":0,"ownerattachmentscount":0,"title":"All","recipientid":null,"content":null,"shortcontent":null,"subject":null,"schoolpersonref":1291988,"schoolpersonname":null,"schoolpersongender":null,"announcementtyperef":2,"systemtype":2,"grade":null,"studentannouncementid":null,"dropped":false,"studentscount":0,"studentscountwithattachments":0,"studentscountwithoutattachments":0,"gradingstudentscount":0,"nongradingstudentscount":0,"comment":null,"class":null,"gradesummary":null,"attachmentsummary":null,"avg":null,"avgnumeric":null,"gradingstyle":0,"applicationscount":0,"applicationname":null,"wasannouncementtypegraded":null,"showgradingicon":false},{"created":"6/25/2013 12:52:24 PM","announcementtypename":"HW","announcementtypeid":2,"expiresdate":"2013-06-28","isowner":true,"gradable":true,"starred":false,"id":156353,"order":56,"state":0,"statetyped":0,"qnacount":0,"attachmentscount":0,"ownerattachmentscount":0,"title":"All","recipientid":null,"content":null,"shortcontent":null,"subject":null,"schoolpersonref":1291988,"schoolpersonname":null,"schoolpersongender":null,"announcementtyperef":2,"systemtype":2,"grade":null,"studentannouncementid":null,"dropped":false,"studentscount":0,"studentscountwithattachments":0,"studentscountwithoutattachments":0,"gradingstudentscount":0,"nongradingstudentscount":0,"comment":null,"class":null,"gradesummary":null,"attachmentsummary":null,"avg":null,"avgnumeric":null,"gradingstyle":0,"applicationscount":0,"applicationname":null,"wasannouncementtypegraded":null,"showgradingicon":false},{"created":"6/28/2013 01:49:21 PM","announcementtypename":"HW","announcementtypeid":2,"expiresdate":"2013-06-29","isowner":true,"gradable":true,"starred":false,"id":159200,"order":57,"state":0,"statetyped":0,"qnacount":0,"attachmentscount":0,"ownerattachmentscount":0,"title":"All","recipientid":null,"content":null,"shortcontent":null,"subject":null,"schoolpersonref":1291988,"schoolpersonname":null,"schoolpersongender":null,"announcementtyperef":2,"systemtype":2,"grade":null,"studentannouncementid":null,"dropped":false,"studentscount":0,"studentscountwithattachments":0,"studentscountwithoutattachments":0,"gradingstudentscount":0,"nongradingstudentscount":0,"comment":null,"class":null,"gradesummary":null,"attachmentsummary":null,"avg":97,"avgnumeric":97,"gradingstyle":0,"applicationscount":0,"applicationname":null,"wasannouncementtypegraded":null,"showgradingicon":false},{"created":"7/2/2013 04:34:38 PM","announcementtypename":"HW","announcementtypeid":2,"expiresdate":"2013-07-03","isowner":true,"gradable":true,"starred":false,"id":162958,"order":58,"state":0,"statetyped":0,"qnacount":0,"attachmentscount":0,"ownerattachmentscount":0,"title":"All","recipientid":null,"content":null,"shortcontent":null,"subject":null,"schoolpersonref":1291988,"schoolpersonname":null,"schoolpersongender":null,"announcementtyperef":2,"systemtype":2,"grade":null,"studentannouncementid":null,"dropped":false,"studentscount":0,"studentscountwithattachments":0,"studentscountwithoutattachments":0,"gradingstudentscount":0,"nongradingstudentscount":0,"comment":null,"class":null,"gradesummary":null,"attachmentsummary":null,"avg":50,"avgnumeric":50,"gradingstyle":0,"applicationscount":0,"applicationname":null,"wasannouncementtypegraded":null,"showgradingicon":false},{"created":"7/8/2013 09:49:23 AM","announcementtypename":"HW","announcementtypeid":2,"expiresdate":"2013-07-09","isowner":true,"gradable":true,"starred":false,"id":165953,"order":59,"state":0,"statetyped":0,"qnacount":0,"attachmentscount":0,"ownerattachmentscount":0,"title":"All","recipientid":null,"content":null,"shortcontent":null,"subject":null,"schoolpersonref":1291988,"schoolpersonname":null,"schoolpersongender":null,"announcementtyperef":2,"systemtype":2,"grade":null,"studentannouncementid":null,"dropped":false,"studentscount":0,"studentscountwithattachments":0,"studentscountwithoutattachments":0,"gradingstudentscount":0,"nongradingstudentscount":0,"comment":null,"class":null,"gradesummary":null,"attachmentsummary":null,"avg":99,"avgnumeric":99,"gradingstyle":0,"applicationscount":0,"applicationname":null,"wasannouncementtypegraded":null,"showgradingicon":false},{"created":"7/8/2013 09:53:52 AM","announcementtypename":"HW","announcementtypeid":2,"expiresdate":"2013-07-09","isowner":true,"gradable":true,"starred":false,"id":165954,"order":60,"state":0,"statetyped":0,"qnacount":0,"attachmentscount":0,"ownerattachmentscount":0,"title":"All","recipientid":null,"content":null,"shortcontent":null,"subject":null,"schoolpersonref":1291988,"schoolpersonname":null,"schoolpersongender":null,"announcementtyperef":2,"systemtype":2,"grade":null,"studentannouncementid":null,"dropped":false,"studentscount":0,"studentscountwithattachments":0,"studentscountwithoutattachments":0,"gradingstudentscount":0,"nongradingstudentscount":0,"comment":null,"class":null,"gradesummary":null,"attachmentsummary":null,"avg":49,"avgnumeric":49,"gradingstyle":0,"applicationscount":0,"applicationname":null,"wasannouncementtypegraded":null,"showgradingicon":false},{"created":"7/18/2013 12:04:45 PM","announcementtypename":"HW","announcementtypeid":2,"expiresdate":"2013-07-19","isowner":true,"gradable":true,"starred":false,"id":172009,"order":61,"state":0,"statetyped":0,"qnacount":0,"attachmentscount":0,"ownerattachmentscount":0,"title":"All","recipientid":null,"content":null,"shortcontent":null,"subject":null,"schoolpersonref":1291988,"schoolpersonname":null,"schoolpersongender":null,"announcementtyperef":2,"systemtype":2,"grade":null,"studentannouncementid":null,"dropped":false,"studentscount":0,"studentscountwithattachments":0,"studentscountwithoutattachments":0,"gradingstudentscount":0,"nongradingstudentscount":0,"comment":null,"class":null,"gradesummary":null,"attachmentsummary":null,"avg":4,"avgnumeric":4,"gradingstyle":0,"applicationscount":0,"applicationname":null,"wasannouncementtypegraded":null,"showgradingicon":false},{"created":"7/19/2013 10:38:27 AM","announcementtypename":"HW","announcementtypeid":2,"expiresdate":"2013-07-25","isowner":true,"gradable":true,"starred":false,"id":172776,"order":62,"state":0,"statetyped":0,"qnacount":0,"attachmentscount":0,"ownerattachmentscount":0,"title":"All","recipientid":null,"content":null,"shortcontent":null,"subject":null,"schoolpersonref":1291988,"schoolpersonname":null,"schoolpersongender":null,"announcementtyperef":2,"systemtype":2,"grade":null,"studentannouncementid":null,"dropped":false,"studentscount":0,"studentscountwithattachments":0,"studentscountwithoutattachments":0,"gradingstudentscount":0,"nongradingstudentscount":0,"comment":null,"class":null,"gradesummary":null,"attachmentsummary":null,"avg":56,"avgnumeric":56,"gradingstyle":0,"applicationscount":0,"applicationname":null,"wasannouncementtypegraded":null,"showgradingicon":false},{"created":"9/10/2013 05:03:55 PM","announcementtypename":"HW","announcementtypeid":2,"expiresdate":"2013-09-11","isowner":true,"gradable":true,"starred":false,"id":204850,"order":63,"state":0,"statetyped":0,"qnacount":0,"attachmentscount":0,"ownerattachmentscount":0,"title":"All","recipientid":null,"content":null,"shortcontent":null,"subject":null,"schoolpersonref":1291988,"schoolpersonname":null,"schoolpersongender":null,"announcementtyperef":2,"systemtype":2,"grade":null,"studentannouncementid":null,"dropped":false,"studentscount":0,"studentscountwithattachments":0,"studentscountwithoutattachments":0,"gradingstudentscount":0,"nongradingstudentscount":0,"comment":null,"class":null,"gradesummary":null,"attachmentsummary":null,"avg":76,"avgnumeric":76,"gradingstyle":0,"applicationscount":0,"applicationname":null,"wasannouncementtypegraded":null,"showgradingicon":false},{"created":"9/11/2013 03:13:00 PM","announcementtypename":"HW","announcementtypeid":2,"expiresdate":"2013-09-12","isowner":true,"gradable":true,"starred":false,"id":205844,"order":64,"state":0,"statetyped":0,"qnacount":0,"attachmentscount":0,"ownerattachmentscount":0,"title":"All","recipientid":null,"content":null,"shortcontent":null,"subject":null,"schoolpersonref":1291988,"schoolpersonname":null,"schoolpersongender":null,"announcementtyperef":2,"systemtype":2,"grade":null,"studentannouncementid":null,"dropped":false,"studentscount":0,"studentscountwithattachments":0,"studentscountwithoutattachments":0,"gradingstudentscount":0,"nongradingstudentscount":0,"comment":null,"class":null,"gradesummary":null,"attachmentsummary":null,"avg":69,"avgnumeric":69,"gradingstyle":0,"applicationscount":0,"applicationname":null,"wasannouncementtypegraded":null,"showgradingicon":false},{"created":"9/12/2013 02:49:14 PM","announcementtypename":"HW","announcementtypeid":2,"expiresdate":"2013-09-13","isowner":true,"gradable":true,"starred":false,"id":206420,"order":65,"state":0,"statetyped":0,"qnacount":0,"attachmentscount":0,"ownerattachmentscount":0,"title":"All","recipientid":null,"content":null,"shortcontent":null,"subject":null,"schoolpersonref":1291988,"schoolpersonname":null,"schoolpersongender":null,"announcementtyperef":2,"systemtype":2,"grade":null,"studentannouncementid":null,"dropped":false,"studentscount":0,"studentscountwithattachments":0,"studentscountwithoutattachments":0,"gradingstudentscount":0,"nongradingstudentscount":0,"comment":null,"class":null,"gradesummary":null,"attachmentsummary":null,"avg":86,"avgnumeric":86,"gradingstyle":0,"applicationscount":0,"applicationname":null,"wasannouncementtypegraded":null,"showgradingicon":false},{"created":"9/12/2013 03:36:04 PM","announcementtypename":"HW","announcementtypeid":2,"expiresdate":"2013-09-13","isowner":true,"gradable":true,"starred":false,"id":206422,"order":66,"state":0,"statetyped":0,"qnacount":0,"attachmentscount":0,"ownerattachmentscount":0,"title":"All","recipientid":null,"content":null,"shortcontent":null,"subject":null,"schoolpersonref":1291988,"schoolpersonname":null,"schoolpersongender":null,"announcementtyperef":2,"systemtype":2,"grade":null,"studentannouncementid":null,"dropped":false,"studentscount":0,"studentscountwithattachments":0,"studentscountwithoutattachments":0,"gradingstudentscount":0,"nongradingstudentscount":0,"comment":null,"class":null,"gradesummary":null,"attachmentsummary":null,"avg":67,"avgnumeric":67,"gradingstyle":0,"applicationscount":0,"applicationname":null,"wasannouncementtypegraded":null,"showgradingicon":false},{"created":"10/4/2013 07:22:28 AM","announcementtypename":"HW","announcementtypeid":2,"expiresdate":"2013-10-07","isowner":true,"gradable":true,"starred":false,"id":216607,"order":67,"state":0,"statetyped":0,"qnacount":0,"attachmentscount":0,"ownerattachmentscount":0,"title":"All","recipientid":null,"content":null,"shortcontent":null,"subject":null,"schoolpersonref":1291988,"schoolpersonname":null,"schoolpersongender":null,"announcementtyperef":2,"systemtype":2,"grade":null,"studentannouncementid":null,"dropped":false,"studentscount":0,"studentscountwithattachments":0,"studentscountwithoutattachments":0,"gradingstudentscount":0,"nongradingstudentscount":0,"comment":null,"class":null,"gradesummary":null,"attachmentsummary":null,"avg":23,"avgnumeric":23,"gradingstyle":0,"applicationscount":0,"applicationname":null,"wasannouncementtypegraded":null,"showgradingicon":false},{"created":"10/7/2013 08:40:06 AM","announcementtypename":"HW","announcementtypeid":2,"expiresdate":"2013-10-08","isowner":true,"gradable":true,"starred":false,"id":217868,"order":68,"state":0,"statetyped":0,"qnacount":0,"attachmentscount":0,"ownerattachmentscount":0,"title":"All","recipientid":null,"content":null,"shortcontent":null,"subject":null,"schoolpersonref":1291988,"schoolpersonname":null,"schoolpersongender":null,"announcementtyperef":2,"systemtype":2,"grade":null,"studentannouncementid":null,"dropped":false,"studentscount":0,"studentscountwithattachments":0,"studentscountwithoutattachments":0,"gradingstudentscount":0,"nongradingstudentscount":0,"comment":null,"class":null,"gradesummary":null,"attachmentsummary":null,"avg":null,"avgnumeric":null,"gradingstyle":0,"applicationscount":0,"applicationname":null,"wasannouncementtypegraded":null,"showgradingicon":false},{"created":"10/7/2013 02:21:56 PM","announcementtypename":"HW","announcementtypeid":2,"expiresdate":"2013-10-08","isowner":true,"gradable":true,"starred":false,"id":218210,"order":69,"state":0,"statetyped":0,"qnacount":0,"attachmentscount":0,"ownerattachmentscount":0,"title":"All","recipientid":null,"content":null,"shortcontent":null,"subject":null,"schoolpersonref":1291988,"schoolpersonname":null,"schoolpersongender":null,"announcementtyperef":2,"systemtype":2,"grade":null,"studentannouncementid":null,"dropped":false,"studentscount":0,"studentscountwithattachments":0,"studentscountwithoutattachments":0,"gradingstudentscount":0,"nongradingstudentscount":0,"comment":null,"class":null,"gradesummary":null,"attachmentsummary":null,"avg":95,"avgnumeric":95,"gradingstyle":0,"applicationscount":0,"applicationname":null,"wasannouncementtypegraded":null,"showgradingicon":false},{"created":"11/18/2013 10:42:38 AM","announcementtypename":"HW","announcementtypeid":2,"expiresdate":"2013-12-07","isowner":true,"gradable":true,"starred":false,"id":246673,"order":70,"state":0,"statetyped":0,"qnacount":0,"attachmentscount":0,"ownerattachmentscount":0,"title":"All","recipientid":null,"content":null,"shortcontent":null,"subject":null,"schoolpersonref":1291988,"schoolpersonname":null,"schoolpersongender":null,"announcementtyperef":2,"systemtype":2,"grade":null,"studentannouncementid":null,"dropped":false,"studentscount":0,"studentscountwithattachments":0,"studentscountwithoutattachments":0,"gradingstudentscount":0,"nongradingstudentscount":0,"comment":null,"class":null,"gradesummary":null,"attachmentsummary":null,"avg":48,"avgnumeric":48,"gradingstyle":0,"applicationscount":0,"applicationname":null,"wasannouncementtypegraded":null,"showgradingicon":false}],"persent":17,"avg":77},{"type":{"id":3,"issystem":true,"cancreate":true,"name":"Essay","description":"Essay"},"announcements":[{"created":"12/18/2012 07:59:22 PM","announcementtypename":"Essay","announcementtypeid":3,"expiresdate":"2012-12-19","isowner":true,"gradable":true,"starred":false,"id":56251,"order":1,"state":0,"statetyped":0,"qnacount":0,"attachmentscount":0,"ownerattachmentscount":0,"title":"All","recipientid":null,"content":null,"shortcontent":null,"subject":null,"schoolpersonref":1291988,"schoolpersonname":null,"schoolpersongender":null,"announcementtyperef":3,"systemtype":3,"grade":null,"studentannouncementid":null,"dropped":false,"studentscount":0,"studentscountwithattachments":0,"studentscountwithoutattachments":0,"gradingstudentscount":0,"nongradingstudentscount":0,"comment":null,"class":null,"gradesummary":null,"attachmentsummary":null,"avg":null,"avgnumeric":null,"gradingstyle":0,"applicationscount":0,"applicationname":null,"wasannouncementtypegraded":null,"showgradingicon":false},{"created":"3/8/2013 07:43:21 PM","announcementtypename":"Essay","announcementtypeid":3,"expiresdate":"2013-03-08","isowner":true,"gradable":true,"starred":false,"id":80342,"order":2,"state":0,"statetyped":0,"qnacount":0,"attachmentscount":0,"ownerattachmentscount":0,"title":"All","recipientid":null,"content":null,"shortcontent":null,"subject":null,"schoolpersonref":1291988,"schoolpersonname":null,"schoolpersongender":null,"announcementtyperef":3,"systemtype":3,"grade":null,"studentannouncementid":null,"dropped":false,"studentscount":0,"studentscountwithattachments":0,"studentscountwithoutattachments":0,"gradingstudentscount":0,"nongradingstudentscount":0,"comment":null,"class":null,"gradesummary":null,"attachmentsummary":null,"avg":54,"avgnumeric":54,"gradingstyle":0,"applicationscount":0,"applicationname":null,"wasannouncementtypegraded":null,"showgradingicon":false},{"created":"3/20/2013 12:19:22 AM","announcementtypename":"Essay","announcementtypeid":3,"expiresdate":"2013-03-20","isowner":true,"gradable":true,"starred":false,"id":92116,"order":3,"state":0,"statetyped":0,"qnacount":0,"attachmentscount":0,"ownerattachmentscount":0,"title":"All","recipientid":null,"content":null,"shortcontent":null,"subject":null,"schoolpersonref":1291988,"schoolpersonname":null,"schoolpersongender":null,"announcementtyperef":3,"systemtype":3,"grade":null,"studentannouncementid":null,"dropped":false,"studentscount":0,"studentscountwithattachments":0,"studentscountwithoutattachments":0,"gradingstudentscount":0,"nongradingstudentscount":0,"comment":null,"class":null,"gradesummary":null,"attachmentsummary":null,"avg":null,"avgnumeric":null,"gradingstyle":0,"applicationscount":0,"applicationname":null,"wasannouncementtypegraded":null,"showgradingicon":false},{"created":"4/1/2013 11:35:19 PM","announcementtypename":"Essay","announcementtypeid":3,"expiresdate":"2013-04-02","isowner":true,"gradable":true,"starred":false,"id":100055,"order":4,"state":0,"statetyped":0,"qnacount":0,"attachmentscount":0,"ownerattachmentscount":0,"title":"All","recipientid":null,"content":null,"shortcontent":null,"subject":null,"schoolpersonref":1291988,"schoolpersonname":null,"schoolpersongender":null,"announcementtyperef":3,"systemtype":3,"grade":null,"studentannouncementid":null,"dropped":false,"studentscount":0,"studentscountwithattachments":0,"studentscountwithoutattachments":0,"gradingstudentscount":0,"nongradingstudentscount":0,"comment":null,"class":null,"gradesummary":null,"attachmentsummary":null,"avg":99,"avgnumeric":99,"gradingstyle":0,"applicationscount":0,"applicationname":null,"wasannouncementtypegraded":null,"showgradingicon":false},{"created":"5/28/2013 07:32:20 PM","announcementtypename":"Essay","announcementtypeid":3,"expiresdate":"2013-05-28","isowner":true,"gradable":true,"starred":false,"id":134513,"order":5,"state":0,"statetyped":0,"qnacount":0,"attachmentscount":0,"ownerattachmentscount":0,"title":"All","recipientid":null,"content":null,"shortcontent":null,"subject":null,"schoolpersonref":1291988,"schoolpersonname":null,"schoolpersongender":null,"announcementtyperef":3,"systemtype":3,"grade":null,"studentannouncementid":null,"dropped":false,"studentscount":0,"studentscountwithattachments":0,"studentscountwithoutattachments":0,"gradingstudentscount":0,"nongradingstudentscount":0,"comment":null,"class":null,"gradesummary":null,"attachmentsummary":null,"avg":null,"avgnumeric":null,"gradingstyle":0,"applicationscount":0,"applicationname":null,"wasannouncementtypegraded":null,"showgradingicon":false},{"created":"4/9/2013 08:27:17 PM","announcementtypename":"Essay","announcementtypeid":3,"expiresdate":"2013-06-18","isowner":true,"gradable":true,"starred":false,"id":106363,"order":6,"state":0,"statetyped":0,"qnacount":0,"attachmentscount":0,"ownerattachmentscount":0,"title":"All","recipientid":null,"content":null,"shortcontent":null,"subject":null,"schoolpersonref":1291988,"schoolpersonname":null,"schoolpersongender":null,"announcementtyperef":3,"systemtype":3,"grade":null,"studentannouncementid":null,"dropped":false,"studentscount":0,"studentscountwithattachments":0,"studentscountwithoutattachments":0,"gradingstudentscount":0,"nongradingstudentscount":0,"comment":null,"class":null,"gradesummary":null,"attachmentsummary":null,"avg":null,"avgnumeric":null,"gradingstyle":0,"applicationscount":0,"applicationname":null,"wasannouncementtypegraded":null,"showgradingicon":false},{"created":"6/19/2013 11:36:40 AM","announcementtypename":"Essay","announcementtypeid":3,"expiresdate":"2013-06-20","isowner":true,"gradable":true,"starred":false,"id":151913,"order":7,"state":0,"statetyped":0,"qnacount":0,"attachmentscount":0,"ownerattachmentscount":0,"title":"All","recipientid":null,"content":null,"shortcontent":null,"subject":null,"schoolpersonref":1291988,"schoolpersonname":null,"schoolpersongender":null,"announcementtyperef":3,"systemtype":3,"grade":null,"studentannouncementid":null,"dropped":false,"studentscount":0,"studentscountwithattachments":0,"studentscountwithoutattachments":0,"gradingstudentscount":0,"nongradingstudentscount":0,"comment":null,"class":null,"gradesummary":null,"attachmentsummary":null,"avg":null,"avgnumeric":null,"gradingstyle":0,"applicationscount":0,"applicationname":null,"wasannouncementtypegraded":null,"showgradingicon":false},{"created":"7/18/2013 03:10:19 PM","announcementtypename":"Essay","announcementtypeid":3,"expiresdate":"2013-07-18","isowner":true,"gradable":true,"starred":false,"id":172296,"order":8,"state":0,"statetyped":0,"qnacount":0,"attachmentscount":0,"ownerattachmentscount":0,"title":"All","recipientid":null,"content":null,"shortcontent":null,"subject":null,"schoolpersonref":1291988,"schoolpersonname":null,"schoolpersongender":null,"announcementtyperef":3,"systemtype":3,"grade":null,"studentannouncementid":null,"dropped":false,"studentscount":0,"studentscountwithattachments":0,"studentscountwithoutattachments":0,"gradingstudentscount":0,"nongradingstudentscount":0,"comment":null,"class":null,"gradesummary":null,"attachmentsummary":null,"avg":32,"avgnumeric":32,"gradingstyle":0,"applicationscount":0,"applicationname":null,"wasannouncementtypegraded":null,"showgradingicon":false},{"created":"10/7/2013 05:32:58 PM","announcementtypename":"Essay","announcementtypeid":3,"expiresdate":"2013-10-07","isowner":true,"gradable":true,"starred":false,"id":218775,"order":9,"state":0,"statetyped":0,"qnacount":0,"attachmentscount":0,"ownerattachmentscount":0,"title":"All","recipientid":null,"content":null,"shortcontent":null,"subject":null,"schoolpersonref":1291988,"schoolpersonname":null,"schoolpersongender":null,"announcementtyperef":3,"systemtype":3,"grade":null,"studentannouncementid":null,"dropped":false,"studentscount":0,"studentscountwithattachments":0,"studentscountwithoutattachments":0,"gradingstudentscount":0,"nongradingstudentscount":0,"comment":null,"class":null,"gradesummary":null,"attachmentsummary":null,"avg":89,"avgnumeric":89,"gradingstyle":0,"applicationscount":0,"applicationname":null,"wasannouncementtypegraded":null,"showgradingicon":false}],"persent":11,"avg":68},{"type":{"id":4,"issystem":true,"cancreate":true,"name":"Quiz","description":"Quiz"},"announcements":[{"created":"4/11/2013 06:15:36 PM","announcementtypename":"Quiz","announcementtypeid":4,"expiresdate":"2013-04-11","isowner":true,"gradable":true,"starred":false,"id":108609,"order":1,"state":0,"statetyped":0,"qnacount":0,"attachmentscount":0,"ownerattachmentscount":0,"title":"All","recipientid":null,"content":null,"shortcontent":null,"subject":null,"schoolpersonref":1291988,"schoolpersonname":null,"schoolpersongender":null,"announcementtyperef":4,"systemtype":4,"grade":null,"studentannouncementid":null,"dropped":false,"studentscount":0,"studentscountwithattachments":0,"studentscountwithoutattachments":0,"gradingstudentscount":0,"nongradingstudentscount":0,"comment":null,"class":null,"gradesummary":null,"attachmentsummary":null,"avg":null,"avgnumeric":null,"gradingstyle":0,"applicationscount":0,"applicationname":null,"wasannouncementtypegraded":null,"showgradingicon":false},{"created":"4/30/2013 01:11:17 AM","announcementtypename":"Quiz","announcementtypeid":4,"expiresdate":"2013-04-30","isowner":true,"gradable":true,"starred":false,"id":119200,"order":2,"state":0,"statetyped":0,"qnacount":0,"attachmentscount":0,"ownerattachmentscount":0,"title":"All","recipientid":null,"content":null,"shortcontent":null,"subject":null,"schoolpersonref":1291988,"schoolpersonname":null,"schoolpersongender":null,"announcementtyperef":4,"systemtype":4,"grade":null,"studentannouncementid":null,"dropped":false,"studentscount":0,"studentscountwithattachments":0,"studentscountwithoutattachments":0,"gradingstudentscount":0,"nongradingstudentscount":0,"comment":null,"class":null,"gradesummary":null,"attachmentsummary":null,"avg":null,"avgnumeric":null,"gradingstyle":0,"applicationscount":0,"applicationname":null,"wasannouncementtypegraded":null,"showgradingicon":false},{"created":"5/28/2013 07:30:12 PM","announcementtypename":"Quiz","announcementtypeid":4,"expiresdate":"2013-05-29","isowner":true,"gradable":true,"starred":false,"id":134512,"order":3,"state":0,"statetyped":0,"qnacount":0,"attachmentscount":0,"ownerattachmentscount":0,"title":"All","recipientid":null,"content":null,"shortcontent":null,"subject":null,"schoolpersonref":1291988,"schoolpersonname":null,"schoolpersongender":null,"announcementtyperef":4,"systemtype":4,"grade":null,"studentannouncementid":null,"dropped":false,"studentscount":0,"studentscountwithattachments":0,"studentscountwithoutattachments":0,"gradingstudentscount":0,"nongradingstudentscount":0,"comment":null,"class":null,"gradesummary":null,"attachmentsummary":null,"avg":null,"avgnumeric":null,"gradingstyle":0,"applicationscount":0,"applicationname":null,"wasannouncementtypegraded":null,"showgradingicon":false},{"created":"6/18/2013 06:17:20 PM","announcementtypename":"Quiz","announcementtypeid":4,"expiresdate":"2013-06-17","isowner":true,"gradable":true,"starred":false,"id":150838,"order":4,"state":0,"statetyped":0,"qnacount":0,"attachmentscount":0,"ownerattachmentscount":0,"title":"All","recipientid":null,"content":null,"shortcontent":null,"subject":null,"schoolpersonref":1291988,"schoolpersonname":null,"schoolpersongender":null,"announcementtyperef":4,"systemtype":4,"grade":null,"studentannouncementid":null,"dropped":false,"studentscount":0,"studentscountwithattachments":0,"studentscountwithoutattachments":0,"gradingstudentscount":0,"nongradingstudentscount":0,"comment":null,"class":null,"gradesummary":null,"attachmentsummary":null,"avg":82,"avgnumeric":82,"gradingstyle":0,"applicationscount":0,"applicationname":null,"wasannouncementtypegraded":null,"showgradingicon":false},{"created":"6/25/2013 12:36:34 PM","announcementtypename":"Quiz","announcementtypeid":4,"expiresdate":"2013-06-26","isowner":true,"gradable":true,"starred":false,"id":156350,"order":5,"state":0,"statetyped":0,"qnacount":0,"attachmentscount":0,"ownerattachmentscount":0,"title":"All","recipientid":null,"content":null,"shortcontent":null,"subject":null,"schoolpersonref":1291988,"schoolpersonname":null,"schoolpersongender":null,"announcementtyperef":4,"systemtype":4,"grade":null,"studentannouncementid":null,"dropped":false,"studentscount":0,"studentscountwithattachments":0,"studentscountwithoutattachments":0,"gradingstudentscount":0,"nongradingstudentscount":0,"comment":null,"class":null,"gradesummary":null,"attachmentsummary":null,"avg":null,"avgnumeric":null,"gradingstyle":0,"applicationscount":0,"applicationname":null,"wasannouncementtypegraded":null,"showgradingicon":false},{"created":"6/25/2013 01:40:26 PM","announcementtypename":"Quiz","announcementtypeid":4,"expiresdate":"2013-06-26","isowner":true,"gradable":true,"starred":false,"id":156538,"order":6,"state":0,"statetyped":0,"qnacount":0,"attachmentscount":0,"ownerattachmentscount":0,"title":"All","recipientid":null,"content":null,"shortcontent":null,"subject":null,"schoolpersonref":1291988,"schoolpersonname":null,"schoolpersongender":null,"announcementtyperef":4,"systemtype":4,"grade":null,"studentannouncementid":null,"dropped":false,"studentscount":0,"studentscountwithattachments":0,"studentscountwithoutattachments":0,"gradingstudentscount":0,"nongradingstudentscount":0,"comment":null,"class":null,"gradesummary":null,"attachmentsummary":null,"avg":null,"avgnumeric":null,"gradingstyle":0,"applicationscount":0,"applicationname":null,"wasannouncementtypegraded":null,"showgradingicon":false},{"created":"8/23/2013 04:02:41 PM","announcementtypename":"Quiz","announcementtypeid":4,"expiresdate":"2013-08-23","isowner":true,"gradable":true,"starred":false,"id":196116,"order":7,"state":0,"statetyped":0,"qnacount":0,"attachmentscount":0,"ownerattachmentscount":0,"title":"All","recipientid":null,"content":null,"shortcontent":null,"subject":null,"schoolpersonref":1291988,"schoolpersonname":null,"schoolpersongender":null,"announcementtyperef":4,"systemtype":4,"grade":null,"studentannouncementid":null,"dropped":false,"studentscount":0,"studentscountwithattachments":0,"studentscountwithoutattachments":0,"gradingstudentscount":0,"nongradingstudentscount":0,"comment":null,"class":null,"gradesummary":null,"attachmentsummary":null,"avg":61,"avgnumeric":61,"gradingstyle":1,"applicationscount":0,"applicationname":null,"wasannouncementtypegraded":null,"showgradingicon":false},{"created":"9/6/2013 03:58:45 PM","announcementtypename":"Quiz","announcementtypeid":4,"expiresdate":"2013-09-06","isowner":true,"gradable":true,"starred":false,"id":203441,"order":8,"state":0,"statetyped":0,"qnacount":0,"attachmentscount":0,"ownerattachmentscount":0,"title":"All","recipientid":null,"content":null,"shortcontent":null,"subject":null,"schoolpersonref":1291988,"schoolpersonname":null,"schoolpersongender":null,"announcementtyperef":4,"systemtype":4,"grade":null,"studentannouncementid":null,"dropped":false,"studentscount":0,"studentscountwithattachments":0,"studentscountwithoutattachments":0,"gradingstudentscount":0,"nongradingstudentscount":0,"comment":null,"class":null,"gradesummary":null,"attachmentsummary":null,"avg":47,"avgnumeric":47,"gradingstyle":1,"applicationscount":0,"applicationname":null,"wasannouncementtypegraded":null,"showgradingicon":false},{"created":"10/8/2013 04:10:14 PM","announcementtypename":"Quiz","announcementtypeid":4,"expiresdate":"2013-10-08","isowner":true,"gradable":true,"starred":false,"id":219276,"order":9,"state":0,"statetyped":0,"qnacount":0,"attachmentscount":0,"ownerattachmentscount":0,"title":"All","recipientid":null,"content":null,"shortcontent":null,"subject":null,"schoolpersonref":1291988,"schoolpersonname":null,"schoolpersongender":null,"announcementtyperef":4,"systemtype":4,"grade":null,"studentannouncementid":null,"dropped":false,"studentscount":0,"studentscountwithattachments":0,"studentscountwithoutattachments":0,"gradingstudentscount":0,"nongradingstudentscount":0,"comment":null,"class":null,"gradesummary":null,"attachmentsummary":null,"avg":null,"avgnumeric":null,"gradingstyle":1,"applicationscount":0,"applicationname":null,"wasannouncementtypegraded":null,"showgradingicon":false}],"persent":11,"avg":63},{"type":{"id":5,"issystem":true,"cancreate":true,"name":"Test","description":"Test"},"announcements":[{"created":"3/18/2013 03:58:53 PM","announcementtypename":"Test","announcementtypeid":5,"expiresdate":"2013-03-18","isowner":true,"gradable":true,"starred":false,"id":91232,"order":1,"state":0,"statetyped":0,"qnacount":0,"attachmentscount":0,"ownerattachmentscount":0,"title":"All","recipientid":null,"content":null,"shortcontent":null,"subject":null,"schoolpersonref":1291988,"schoolpersonname":null,"schoolpersongender":null,"announcementtyperef":5,"systemtype":5,"grade":null,"studentannouncementid":null,"dropped":false,"studentscount":0,"studentscountwithattachments":0,"studentscountwithoutattachments":0,"gradingstudentscount":0,"nongradingstudentscount":0,"comment":null,"class":null,"gradesummary":null,"attachmentsummary":null,"avg":76,"avgnumeric":76,"gradingstyle":0,"applicationscount":0,"applicationname":null,"wasannouncementtypegraded":null,"showgradingicon":false},{"created":"4/9/2013 05:37:51 PM","announcementtypename":"Test","announcementtypeid":5,"expiresdate":"2013-04-09","isowner":true,"gradable":true,"starred":false,"id":105801,"order":2,"state":0,"statetyped":0,"qnacount":0,"attachmentscount":0,"ownerattachmentscount":0,"title":"All","recipientid":null,"content":null,"shortcontent":null,"subject":null,"schoolpersonref":1291988,"schoolpersonname":null,"schoolpersongender":null,"announcementtyperef":5,"systemtype":5,"grade":null,"studentannouncementid":null,"dropped":false,"studentscount":0,"studentscountwithattachments":0,"studentscountwithoutattachments":0,"gradingstudentscount":0,"nongradingstudentscount":0,"comment":null,"class":null,"gradesummary":null,"attachmentsummary":null,"avg":null,"avgnumeric":null,"gradingstyle":0,"applicationscount":0,"applicationname":null,"wasannouncementtypegraded":null,"showgradingicon":false},{"created":"4/11/2013 06:15:52 PM","announcementtypename":"Test","announcementtypeid":5,"expiresdate":"2013-04-11","isowner":true,"gradable":true,"starred":false,"id":108610,"order":3,"state":0,"statetyped":0,"qnacount":0,"attachmentscount":0,"ownerattachmentscount":0,"title":"All","recipientid":null,"content":null,"shortcontent":null,"subject":null,"schoolpersonref":1291988,"schoolpersonname":null,"schoolpersongender":null,"announcementtyperef":5,"systemtype":5,"grade":null,"studentannouncementid":null,"dropped":false,"studentscount":0,"studentscountwithattachments":0,"studentscountwithoutattachments":0,"gradingstudentscount":0,"nongradingstudentscount":0,"comment":null,"class":null,"gradesummary":null,"attachmentsummary":null,"avg":null,"avgnumeric":null,"gradingstyle":0,"applicationscount":0,"applicationname":null,"wasannouncementtypegraded":null,"showgradingicon":false},{"created":"5/13/2013 03:33:34 PM","announcementtypename":"Test","announcementtypeid":5,"expiresdate":"2013-05-13","isowner":true,"gradable":true,"starred":false,"id":124520,"order":4,"state":0,"statetyped":0,"qnacount":0,"attachmentscount":0,"ownerattachmentscount":0,"title":"All","recipientid":null,"content":null,"shortcontent":null,"subject":null,"schoolpersonref":1291988,"schoolpersonname":null,"schoolpersongender":null,"announcementtyperef":5,"systemtype":5,"grade":null,"studentannouncementid":null,"dropped":false,"studentscount":0,"studentscountwithattachments":0,"studentscountwithoutattachments":0,"gradingstudentscount":0,"nongradingstudentscount":0,"comment":null,"class":null,"gradesummary":null,"attachmentsummary":null,"avg":59,"avgnumeric":59,"gradingstyle":0,"applicationscount":0,"applicationname":null,"wasannouncementtypegraded":null,"showgradingicon":false}],"persent":11,"avg":68},{"type":{"id":6,"issystem":true,"cancreate":true,"name":"Project","description":"Project"},"announcements":[{"created":"3/8/2013 07:43:57 PM","announcementtypename":"Project","announcementtypeid":6,"expiresdate":"2013-03-08","isowner":true,"gradable":true,"starred":false,"id":84869,"order":1,"state":0,"statetyped":0,"qnacount":0,"attachmentscount":0,"ownerattachmentscount":0,"title":"All","recipientid":null,"content":null,"shortcontent":null,"subject":null,"schoolpersonref":1291988,"schoolpersonname":null,"schoolpersongender":null,"announcementtyperef":6,"systemtype":6,"grade":null,"studentannouncementid":null,"dropped":false,"studentscount":0,"studentscountwithattachments":0,"studentscountwithoutattachments":0,"gradingstudentscount":0,"nongradingstudentscount":0,"comment":null,"class":null,"gradesummary":null,"attachmentsummary":null,"avg":null,"avgnumeric":null,"gradingstyle":0,"applicationscount":0,"applicationname":null,"wasannouncementtypegraded":null,"showgradingicon":false},{"created":"3/18/2013 09:54:23 PM","announcementtypename":"Project","announcementtypeid":6,"expiresdate":"2013-03-19","isowner":true,"gradable":true,"starred":false,"id":91548,"order":2,"state":0,"statetyped":0,"qnacount":0,"attachmentscount":0,"ownerattachmentscount":0,"title":"All","recipientid":null,"content":null,"shortcontent":null,"subject":null,"schoolpersonref":1291988,"schoolpersonname":null,"schoolpersongender":null,"announcementtyperef":6,"systemtype":6,"grade":null,"studentannouncementid":null,"dropped":false,"studentscount":0,"studentscountwithattachments":0,"studentscountwithoutattachments":0,"gradingstudentscount":0,"nongradingstudentscount":0,"comment":null,"class":null,"gradesummary":null,"attachmentsummary":null,"avg":88,"avgnumeric":88,"gradingstyle":0,"applicationscount":0,"applicationname":null,"wasannouncementtypegraded":null,"showgradingicon":false},{"created":"3/27/2013 08:17:58 PM","announcementtypename":"Project","announcementtypeid":6,"expiresdate":"2013-03-29","isowner":true,"gradable":true,"starred":false,"id":98262,"order":3,"state":0,"statetyped":0,"qnacount":0,"attachmentscount":0,"ownerattachmentscount":0,"title":"All","recipientid":null,"content":null,"shortcontent":null,"subject":null,"schoolpersonref":1291988,"schoolpersonname":null,"schoolpersongender":null,"announcementtyperef":6,"systemtype":6,"grade":null,"studentannouncementid":null,"dropped":false,"studentscount":0,"studentscountwithattachments":0,"studentscountwithoutattachments":0,"gradingstudentscount":0,"nongradingstudentscount":0,"comment":null,"class":null,"gradesummary":null,"attachmentsummary":null,"avg":null,"avgnumeric":null,"gradingstyle":0,"applicationscount":0,"applicationname":null,"wasannouncementtypegraded":null,"showgradingicon":false},{"created":"4/15/2013 05:16:43 PM","announcementtypename":"Project","announcementtypeid":6,"expiresdate":"2013-04-16","isowner":true,"gradable":true,"starred":false,"id":111481,"order":4,"state":0,"statetyped":0,"qnacount":0,"attachmentscount":0,"ownerattachmentscount":0,"title":"All","recipientid":null,"content":null,"shortcontent":null,"subject":null,"schoolpersonref":1291988,"schoolpersonname":null,"schoolpersongender":null,"announcementtyperef":6,"systemtype":6,"grade":null,"studentannouncementid":null,"dropped":false,"studentscount":0,"studentscountwithattachments":0,"studentscountwithoutattachments":0,"gradingstudentscount":0,"nongradingstudentscount":0,"comment":null,"class":null,"gradesummary":null,"attachmentsummary":null,"avg":null,"avgnumeric":null,"gradingstyle":0,"applicationscount":0,"applicationname":null,"wasannouncementtypegraded":null,"showgradingicon":false},{"created":"7/18/2013 05:34:00 PM","announcementtypename":"Project","announcementtypeid":6,"expiresdate":"2013-07-18","isowner":true,"gradable":true,"starred":false,"id":172429,"order":5,"state":0,"statetyped":0,"qnacount":0,"attachmentscount":0,"ownerattachmentscount":0,"title":"All","recipientid":null,"content":null,"shortcontent":null,"subject":null,"schoolpersonref":1291988,"schoolpersonname":null,"schoolpersongender":null,"announcementtyperef":6,"systemtype":6,"grade":null,"studentannouncementid":null,"dropped":false,"studentscount":0,"studentscountwithattachments":0,"studentscountwithoutattachments":0,"gradingstudentscount":0,"nongradingstudentscount":0,"comment":null,"class":null,"gradesummary":null,"attachmentsummary":null,"avg":6,"avgnumeric":6,"gradingstyle":0,"applicationscount":0,"applicationname":null,"wasannouncementtypegraded":null,"showgradingicon":false},{"created":"8/27/2013 01:44:49 PM","announcementtypename":"Project","announcementtypeid":6,"expiresdate":"2013-08-27","isowner":true,"gradable":true,"starred":false,"id":198259,"order":6,"state":0,"statetyped":0,"qnacount":0,"attachmentscount":0,"ownerattachmentscount":0,"title":"All","recipientid":null,"content":null,"shortcontent":null,"subject":null,"schoolpersonref":1291988,"schoolpersonname":null,"schoolpersongender":null,"announcementtyperef":6,"systemtype":6,"grade":null,"studentannouncementid":null,"dropped":false,"studentscount":0,"studentscountwithattachments":0,"studentscountwithoutattachments":0,"gradingstudentscount":0,"nongradingstudentscount":0,"comment":null,"class":null,"gradesummary":null,"attachmentsummary":null,"avg":32,"avgnumeric":32,"gradingstyle":0,"applicationscount":0,"applicationname":null,"wasannouncementtypegraded":null,"showgradingicon":false},{"created":"10/29/2013 01:27:00 PM","announcementtypename":"Project","announcementtypeid":6,"expiresdate":"2013-10-30","isowner":true,"gradable":true,"starred":false,"id":234813,"order":7,"state":0,"statetyped":0,"qnacount":0,"attachmentscount":0,"ownerattachmentscount":0,"title":"All","recipientid":null,"content":null,"shortcontent":null,"subject":null,"schoolpersonref":1291988,"schoolpersonname":null,"schoolpersongender":null,"announcementtyperef":6,"systemtype":6,"grade":null,"studentannouncementid":null,"dropped":false,"studentscount":0,"studentscountwithattachments":0,"studentscountwithoutattachments":0,"gradingstudentscount":0,"nongradingstudentscount":0,"comment":null,"class":null,"gradesummary":null,"attachmentsummary":null,"avg":74,"avgnumeric":74,"gradingstyle":0,"applicationscount":0,"applicationname":null,"wasannouncementtypegraded":null,"showgradingicon":false},{"created":"11/12/2013 03:15:03 PM","announcementtypename":"Project","announcementtypeid":6,"expiresdate":"2013-11-19","isowner":true,"gradable":true,"starred":false,"id":243415,"order":8,"state":0,"statetyped":0,"qnacount":0,"attachmentscount":0,"ownerattachmentscount":0,"title":"All","recipientid":null,"content":null,"shortcontent":null,"subject":null,"schoolpersonref":1291988,"schoolpersonname":null,"schoolpersongender":null,"announcementtyperef":6,"systemtype":6,"grade":null,"studentannouncementid":null,"dropped":false,"studentscount":0,"studentscountwithattachments":0,"studentscountwithoutattachments":0,"gradingstudentscount":0,"nongradingstudentscount":0,"comment":null,"class":null,"gradesummary":null,"attachmentsummary":null,"avg":41,"avgnumeric":41,"gradingstyle":0,"applicationscount":0,"applicationname":null,"wasannouncementtypegraded":null,"showgradingicon":false}],"persent":11,"avg":48},{"type":{"id":7,"issystem":true,"cancreate":true,"name":"Final","description":"Final"},"announcements":[{"created":"3/20/2013 03:33:10 PM","announcementtypename":"Final","announcementtypeid":7,"expiresdate":"2013-03-20","isowner":true,"gradable":true,"starred":false,"id":92119,"order":1,"state":0,"statetyped":0,"qnacount":0,"attachmentscount":0,"ownerattachmentscount":0,"title":"All","recipientid":null,"content":null,"shortcontent":null,"subject":null,"schoolpersonref":1291988,"schoolpersonname":null,"schoolpersongender":null,"announcementtyperef":7,"systemtype":7,"grade":null,"studentannouncementid":null,"dropped":false,"studentscount":0,"studentscountwithattachments":0,"studentscountwithoutattachments":0,"gradingstudentscount":0,"nongradingstudentscount":0,"comment":null,"class":null,"gradesummary":null,"attachmentsummary":null,"avg":null,"avgnumeric":null,"gradingstyle":0,"applicationscount":0,"applicationname":null,"wasannouncementtypegraded":null,"showgradingicon":false},{"created":"4/23/2013 11:40:57 PM","announcementtypename":"Final","announcementtypeid":7,"expiresdate":"2013-04-25","isowner":true,"gradable":true,"starred":false,"id":116480,"order":2,"state":0,"statetyped":0,"qnacount":0,"attachmentscount":0,"ownerattachmentscount":0,"title":"All","recipientid":null,"content":null,"shortcontent":null,"subject":null,"schoolpersonref":1291988,"schoolpersonname":null,"schoolpersongender":null,"announcementtyperef":7,"systemtype":7,"grade":null,"studentannouncementid":null,"dropped":false,"studentscount":0,"studentscountwithattachments":0,"studentscountwithoutattachments":0,"gradingstudentscount":0,"nongradingstudentscount":0,"comment":null,"class":null,"gradesummary":null,"attachmentsummary":null,"avg":75,"avgnumeric":75,"gradingstyle":0,"applicationscount":0,"applicationname":null,"wasannouncementtypegraded":null,"showgradingicon":false}],"persent":5,"avg":75},{"type":{"id":8,"issystem":true,"cancreate":true,"name":"Midterm","description":"Midterm"},"announcements":[{"created":"4/10/2013 04:01:52 PM","announcementtypename":"Midterm","announcementtypeid":8,"expiresdate":"2013-04-10","isowner":true,"gradable":true,"starred":false,"id":106973,"order":1,"state":0,"statetyped":0,"qnacount":0,"attachmentscount":0,"ownerattachmentscount":0,"title":"All","recipientid":null,"content":null,"shortcontent":null,"subject":null,"schoolpersonref":1291988,"schoolpersonname":null,"schoolpersongender":null,"announcementtyperef":8,"systemtype":8,"grade":null,"studentannouncementid":null,"dropped":false,"studentscount":0,"studentscountwithattachments":0,"studentscountwithoutattachments":0,"gradingstudentscount":0,"nongradingstudentscount":0,"comment":null,"class":null,"gradesummary":null,"attachmentsummary":null,"avg":null,"avgnumeric":null,"gradingstyle":0,"applicationscount":0,"applicationname":null,"wasannouncementtypegraded":null,"showgradingicon":false},{"created":"4/26/2013 07:06:16 PM","announcementtypename":"Midterm","announcementtypeid":8,"expiresdate":"2013-04-27","isowner":true,"gradable":true,"starred":false,"id":117452,"order":2,"state":0,"statetyped":0,"qnacount":0,"attachmentscount":0,"ownerattachmentscount":0,"title":"All","recipientid":null,"content":null,"shortcontent":null,"subject":null,"schoolpersonref":1291988,"schoolpersonname":null,"schoolpersongender":null,"announcementtyperef":8,"systemtype":8,"grade":null,"studentannouncementid":null,"dropped":false,"studentscount":0,"studentscountwithattachments":0,"studentscountwithoutattachments":0,"gradingstudentscount":0,"nongradingstudentscount":0,"comment":null,"class":null,"gradesummary":null,"attachmentsummary":null,"avg":null,"avgnumeric":null,"gradingstyle":0,"applicationscount":0,"applicationname":null,"wasannouncementtypegraded":null,"showgradingicon":false},{"created":"4/30/2013 01:11:31 AM","announcementtypename":"Midterm","announcementtypeid":8,"expiresdate":"2013-04-28","isowner":true,"gradable":true,"starred":false,"id":119199,"order":3,"state":0,"statetyped":0,"qnacount":0,"attachmentscount":0,"ownerattachmentscount":0,"title":"All","recipientid":null,"content":null,"shortcontent":null,"subject":null,"schoolpersonref":1291988,"schoolpersonname":null,"schoolpersongender":null,"announcementtyperef":8,"systemtype":8,"grade":null,"studentannouncementid":null,"dropped":false,"studentscount":0,"studentscountwithattachments":0,"studentscountwithoutattachments":0,"gradingstudentscount":0,"nongradingstudentscount":0,"comment":null,"class":null,"gradesummary":null,"attachmentsummary":null,"avg":null,"avgnumeric":null,"gradingstyle":0,"applicationscount":0,"applicationname":null,"wasannouncementtypegraded":null,"showgradingicon":false},{"created":"7/18/2013 05:38:59 PM","announcementtypename":"Midterm","announcementtypeid":8,"expiresdate":"2013-07-18","isowner":true,"gradable":true,"starred":false,"id":172457,"order":4,"state":0,"statetyped":0,"qnacount":0,"attachmentscount":0,"ownerattachmentscount":0,"title":"All","recipientid":null,"content":null,"shortcontent":null,"subject":null,"schoolpersonref":1291988,"schoolpersonname":null,"schoolpersongender":null,"announcementtyperef":8,"systemtype":8,"grade":null,"studentannouncementid":null,"dropped":false,"studentscount":0,"studentscountwithattachments":0,"studentscountwithoutattachments":0,"gradingstudentscount":0,"nongradingstudentscount":0,"comment":null,"class":null,"gradesummary":null,"attachmentsummary":null,"avg":null,"avgnumeric":null,"gradingstyle":0,"applicationscount":0,"applicationname":null,"wasannouncementtypegraded":null,"showgradingicon":false}],"persent":11,"avg":null},{"type":{"id":9,"issystem":true,"cancreate":true,"name":"Book report","description":"Book report"},"announcements":[{"created":"2/12/2013 04:25:57 PM","announcementtypename":"Book report","announcementtypeid":9,"expiresdate":"2013-02-13","isowner":true,"gradable":true,"starred":false,"id":71960,"order":1,"state":0,"statetyped":0,"qnacount":0,"attachmentscount":0,"ownerattachmentscount":0,"title":"All","recipientid":null,"content":null,"shortcontent":null,"subject":null,"schoolpersonref":1291988,"schoolpersonname":null,"schoolpersongender":null,"announcementtyperef":9,"systemtype":9,"grade":null,"studentannouncementid":null,"dropped":false,"studentscount":0,"studentscountwithattachments":0,"studentscountwithoutattachments":0,"gradingstudentscount":0,"nongradingstudentscount":0,"comment":null,"class":null,"gradesummary":null,"attachmentsummary":null,"avg":53,"avgnumeric":53,"gradingstyle":0,"applicationscount":0,"applicationname":null,"wasannouncementtypegraded":null,"showgradingicon":false},{"created":"3/21/2013 01:15:30 AM","announcementtypename":"Book report","announcementtypeid":9,"expiresdate":"2013-03-21","isowner":true,"gradable":true,"starred":false,"id":93130,"order":2,"state":0,"statetyped":0,"qnacount":0,"attachmentscount":0,"ownerattachmentscount":0,"title":"All","recipientid":null,"content":null,"shortcontent":null,"subject":null,"schoolpersonref":1291988,"schoolpersonname":null,"schoolpersongender":null,"announcementtyperef":9,"systemtype":9,"grade":null,"studentannouncementid":null,"dropped":false,"studentscount":0,"studentscountwithattachments":0,"studentscountwithoutattachments":0,"gradingstudentscount":0,"nongradingstudentscount":0,"comment":null,"class":null,"gradesummary":null,"attachmentsummary":null,"avg":null,"avgnumeric":null,"gradingstyle":0,"applicationscount":0,"applicationname":null,"wasannouncementtypegraded":null,"showgradingicon":false},{"created":"7/18/2013 05:39:16 PM","announcementtypename":"Book report","announcementtypeid":9,"expiresdate":"2013-07-19","isowner":true,"gradable":true,"starred":false,"id":172458,"order":3,"state":0,"statetyped":0,"qnacount":0,"attachmentscount":0,"ownerattachmentscount":0,"title":"All","recipientid":null,"content":null,"shortcontent":null,"subject":null,"schoolpersonref":1291988,"schoolpersonname":null,"schoolpersongender":null,"announcementtyperef":9,"systemtype":9,"grade":null,"studentannouncementid":null,"dropped":false,"studentscount":0,"studentscountwithattachments":0,"studentscountwithoutattachments":0,"gradingstudentscount":0,"nongradingstudentscount":0,"comment":null,"class":null,"gradesummary":null,"attachmentsummary":null,"avg":40,"avgnumeric":40,"gradingstyle":0,"applicationscount":0,"applicationname":null,"wasannouncementtypegraded":null,"showgradingicon":false},{"created":"8/27/2013 01:46:29 PM","announcementtypename":"Book report","announcementtypeid":9,"expiresdate":"2013-08-27","isowner":true,"gradable":true,"starred":false,"id":198260,"order":4,"state":0,"statetyped":0,"qnacount":0,"attachmentscount":0,"ownerattachmentscount":0,"title":"All","recipientid":null,"content":null,"shortcontent":null,"subject":null,"schoolpersonref":1291988,"schoolpersonname":null,"schoolpersongender":null,"announcementtyperef":9,"systemtype":9,"grade":null,"studentannouncementid":null,"dropped":false,"studentscount":0,"studentscountwithattachments":0,"studentscountwithoutattachments":0,"gradingstudentscount":0,"nongradingstudentscount":0,"comment":null,"class":null,"gradesummary":null,"attachmentsummary":null,"avg":49,"avgnumeric":49,"gradingstyle":0,"applicationscount":0,"applicationname":null,"wasannouncementtypegraded":null,"showgradingicon":false}],"persent":11,"avg":47},{"type":{"id":10,"issystem":true,"cancreate":true,"name":"Term paper","description":"Term paper"},"announcements":[],"persent":11,"avg":null}],"markingperiodid":15156,"markingperiodname":"Default","markingperiodstartdate":"2012-09-25","markingperiodenddate":"2014-03-25","avg":71}],"success":true}